,unique_id,city,job_qry,job_title,company_name,location,summary,salary,link,date
1,pj_855752100bbb0729,Chicago,data+engineer,Data Engineer,"SMS Assist, LLC",NOT_FOUND,"The Data Engineer role has to work across the following areas:. The Data Engineer is responsible for applying your expertise in quantitative analysis, database...",NOT_FOUND,https://www.indeed.com/pagead/clk?mo=r&ad=-6NYlbfkN0Azf24ceGmJeoddGoGdtujU3GsUDah2gM-7e14s1pjaUtWzN6BvzuI23xYyb0EFlptM3Z-IlhvplofC_UCW5N1BylJ09zu1Mhg-7Pl0_MBfxJYc-4mZvrdPYCjzoVIQquk2Fjdx89yWB2mykO63U1xDW110rIJ4bQ0o7JNRt8RGjhm5LmGjNK2mI5pcvWpC4-e4_FT9JHa8UO4yKxtvS6gNdMiI-KtMfXR8uyt2VkRUtIpET9PCaG4Dbek0r_-TFByKMhrgr9ADcdHbavVjhUQlVFyI-ZJpMmkcoTKlXOBq1sz2CxYVe7WMhsjhohn5h_8XBQMxh9rT53UXBDqsnCj2bbhSo6BvAr_XeCiv5SQaPxR2uWci8fUSONy99tRDpJj0-dkyMB2mhSJw1qVoVB7fGBbyZqqx4NPKwuJwBiGK9K6rBft68XtSGH1kxW9xYb7cKnbXZD7c2bKDmN81DFAdCyDOQCTru0oNDAAtvIOOfVgJ1DX9MYekLB8zm6IoC90rEDx85h9St_DPC_zUVfYp_FL3rD9PtoPKEhWYCG7XWw==&p=0&fvj=0&vjs=3,NOT_FOUND
2,pj_ae4a0328702cef77,Chicago,data+engineer,Data Processing Engineer (Junior),The Core Organization,NOT_FOUND,"Data Processing Engineer (Junior)*. Our engineers are responsible for completing daily data processing activities, including postal processing, report creation...","
                $30,000 - $45,000 a year",https://www.indeed.com/pagead/clk?mo=r&ad=-6NYlbfkN0D109no4bUrp723nlI1tSXCTvb0XOsNkQXy7jovH4rRrY1-IyUTA5v_KG5b-WEFtyHRZQ67fO6AnuNZ1djwIac_QwQBvD04PcLdtQXglzpm90PmI4E8ztEhyf35Y_N-SOOVEglttXij5t60vF86E4LIqsH0Xkrcg9kGZp2oHaUeFalqtMShzx6b9GPwr3UGh62bx9tOsAhfPMJDz0hCaRTxe5hyX4BllDmhtioorXBVtvdZRLTzWppSKVsoxC2b7G2J6KYY3Ui2ZL6lwzT5NOk1M2m63c3C9gXn1bTTMdEUKp2QGLtcSoJdiot0q7F9EYbb5-EIaXZIf0VaVhcSPfnLBk3aSGpZcqg4CSgqLcPLjyaEBHQlMmajswNM51Ga3YOnbYkqhXlUFA1f32X4Fkej7PT6IKEdsNUuRm5VGQkGyHPrUVfGQKFniUVrYaF6OWM=&p=1&fvj=1&vjs=3,NOT_FOUND
3,pj_7f40752a3ac8760e,Chicago,data+engineer,Associate Engineer,"Reserve Advisors, Inc.",NOT_FOUND,"Become familiarized with the schedule, routine and work process of Associate Engineers, Engineers, Senior Engineers and the Regional Engineering Manager....",NOT_FOUND,https://www.indeed.com/pagead/clk?mo=r&ad=-6NYlbfkN0BFkco8LjqT1MbDJiWVxr_1paC57h1MBS10z5Tk1ROgt-jslHd9gnKOLDkjGxJO6o0M-CU7velqRChL-wKiA0gdnvEM5BWYA-gzYPJYz2T04AyizCvSUDYFPyVSygmfKxxQk3DjUIxeihwpzK7dsKjynXlim3Ai0RUUNP7dEonkCQq3eeVOQJuTr_XPUTxHX0mH-tfoUOXeREc34FYaR4qv2tExK44owO4DCnh4BkQ38qkgxFynl2wkdycmnHxQK3oVysU2DH4lTpRB2mSAbQoRQoVwCjzeJR9NID5zuTbNc4ItmGJnu-kMIWJ2MUuVVpVluWZIoIxaQh8dSveBkYaWP6vB-vvIlsoCR8-vcQy8BGZHfTFzxBk7bVltqF7JrXW8UrvMhpS0KGCTcjt2jLhlqdYgtg8pCLIJM4-iMOAjcMVmHoABR_iE&p=2&fvj=1&vjs=3,NOT_FOUND
4,pj_4eb4a3b474554cff,Chicago,data+engineer,Sr. Data Engineer,Echo Global Logistics,NOT_FOUND,"Data Engineer's work in conjunction with Software Engineers, DBA's, Business Analysts, Quality Assurance and business owners....",NOT_FOUND,https://www.indeed.com/pagead/clk?mo=r&ad=-6NYlbfkN0BTjlGj5JvLfH__h7ZRGeXDIcGXy_3l5WUsOynPPMXwb1WFCX8IUjj39FR922UkfvttvhoYJSd-Y5JyFHDVoRkqYH0BQ_n3-Tzemr4_p8mBHMMJBSsyWPFL_PKBWuov6zmIiglU0TLh094CVJizK7qk2B5-4OY8ndw6TVtbDqThRJ24P_0ROTjbo3VNz58Erf3sQ65JRC5MhPCI4F_2mHe6eJ2oGN9Z-F2BbycgvyW1D3PSrWxWPYdx1gp9sM1VHLiWGCtAZpMJ88sM2Uh2z0GCzEiEDmSk4YvIyxh6jQTnWeWSCCNQysz6eJf8h5RbGCAZH87SFQAHXllAlUwS_UVDnFmPeomkZXOjfRfgRSFoQ3wYbacfesqoWxkyJAtdoJ4=&p=3&fvj=0&vjs=3,NOT_FOUND
5,pj_7c48becb5f622b2e,Chicago,data+engineer,SQL Server Data Engineer,Paul May & Associates,NOT_FOUND,"SQL Server Data Engineer. Data Engineer’s work in conjunction with Software Engineers, DBA’s, Business Analysts, Quality Assurance and business owners....","
                $100,000 - $145,000 a year",https://www.indeed.com/pagead/clk?mo=r&ad=-6NYlbfkN0AtmmgL-6xvNJ2TgfBOZULzFUyk3B45PtfzaCI94ECTxCQ4YqVW-kqsqhBVKZtXnQdzzbF-I5KZVa_5WBIpDW_npQKNek2lnOsdrW2ZwfNcMSGFJEUQPk42GN_t8dWeCXFy0zdg3awWmzCSTqqti4sbSpiBVApmjBsw5WTQnU1KqdEhHok9QZjRe_yVgsvH5GX1T6Bl350m44DnIz9IzI5QIP_cHIIL8BY0LmdrNukh39WmaSXba-8GiEhA6DDU7YWRI2Pb-Qy0_o84_6AWF1-YWCdIclnuOTGOaqtbR0fVoVjs8RJSISkUFV8A-VKSMImilasWyOzJWyGLzilKERM9RYRxS-rgW7HNlqo8_Bn5IyzLNTf3tIKF3NT5ftYWO4QtzHsbaTujxxwxVeQuMdOnBvUF5YaKUmWiZdrVDfCYL8SWr29aWLIAl8j0oXcANQQPZFDBkiTSqg==&p=4&fvj=1&vjs=3,NOT_FOUND
6,pj_5ccf5672b182ceb5,Chicago,data+engineer,Data Engineer,PNC Financial Services Group,NOT_FOUND,"Data Architecture - Basic Experience. As a Data Engineer (hadoop) within PNC's Technology and Innovation organization, can be based in Pittsburgh, PA;...",NOT_FOUND,https://www.indeed.com/pagead/clk?mo=r&ad=-6NYlbfkN0AMofH_6zXbiqn6xehDj89HQNfpf30LHk40Y3Yl5cZTpi6PEICC7pMg_HwfIsLXdbvkgu7vi_4YTkgWbL4IKBUhhQ7ZuqFeuMv7_baf-YYF56L64RzKVhfQGZmOphXDIi4FX7Ol2hMoLOll6hIjxNXjKiL7H0ZNLEbipdCzjrjbuEUYCRZjw4z2YB3guu6i2HaAtX8R4mtbe8RMzhU4s0AOW2lW_JIFBXrpqXCYhXA9fssNrzTgn9Uy2yQT9Hufkjlm2YhHbBQbl0LNpWA2R81lanKpiJKhjKc5S8TaDkyI8Y9me3-WRjsJHm26tIzEgYZUyQ9hJCKGw9XJR3rNflQTd-d03EhajHhiQV347jB46Y2hTRrDgxPRVYmX_kvGT2y_zigil8SJhZNr0sfZ_5RndxxWvilwZ1o=&p=5&fvj=0&vjs=3,2 days ago
7,pj_2c215f92714781ae,Chicago,data+engineer,"""Guide"" Telephone Representative (Remote)",ASSURANCE,NOT_FOUND,"Our team of engineers, data scientists, marketers, architects, and designers are building systems using advanced science to make humans better....","
                $15 - $45 an hour",https://www.indeed.com/pagead/clk?mo=r&ad=-6NYlbfkN0Ay34pLxNpM2b2APydG9FPHc7HhqjeNrk9_gDXaaFM3GhdpWVlroe6JqlZhsdxePfrzEmlIgeNT-LieXQ_0S4twn9Vntij7WrPilgoX9MGRYct7gZaSdEdS8GDbJULchIY1I4N3wXqKV1nSAlQCg_eCpBExIpCpGLqF30KI1-Q6plGEBtCadJL1HUZlg8HYMf4bnk6YaOWeE5l2sS3inLv8izl_T07AsyPY_Y-GfzaEybiiKzVIGgwWSCYvH09HCLqEODBLDDsszhe5khbNJqHOeygWuKOiZ-lbDmctT3pfFtnBZzs724rTOPEvJfHUeFCTIwJhR49yEjSWAD05CbJvpOEXq0TjnQLL6i-rB1CJ-M_bnJTBu1epQ8TZrK_psx3YS-Q5cfsQ2xfw_os3HF7pO2-thu3S2qZsr7It0vu689wx49xAFEYS&p=6&fvj=1&vjs=3,NOT_FOUND
8,pj_c632718fa83e640a,Chicago,data+engineer,Lead Data Engineer,HNI Corporation,NOT_FOUND,"As a member of the Decision Science team located in Chicago, the Lead Data Engineer will play a crucial role in building HNI’s data engineering team....",NOT_FOUND,https://www.indeed.com/pagead/clk?mo=r&ad=-6NYlbfkN0Atbdg0bKLfsMf-XrvW-mGXYBBmUmFJMxfHxiCcZI386bZZErgOHOnp8FGa_pu4CvDiJ18akOtGXIcWt4o_UOHlr_NHfLUXRM2vfIvrSc12_M5D0ryuBSpn2sRGnfbPTkizXFvjuUoCFjHFN8NI1b_tO8rYDq_4PTkhJ0pFuwFNe90Fjb8O_iOfniDpBI29n-GwRhWJCa7qprAhRQdfrddz5u5gX9loN4tJBA2QcO2ieBse7FTvs9VFrKAEfdy78NHeuzF84vwbtkHXQhk9YrU2ZXedyp-YCkA0Yov3aaPdNBTvF8hywwnn28A7tBsNjsA3Pqse4yqJxHQdJ9NEdBDmHwGY_i1zZyIVe0vT7Hxx-lupNiz6HTigehiOc7SKYHRyzUTvGMVMz2UiBOm01pK05fXAcbO-I8NYpTSZOiph46-t9UZFFOxF&p=7&fvj=1&vjs=3,NOT_FOUND
9,p_632ce24625fbe2aa,Chicago,data+engineer,"Associate, Data Engineer",KPMG,"Chicago, IL 60290 (Loop area)",A minimum of three years' experience working as a data engineer. Support build of big data environments that enable analytics solutions on a variety of big data...,NOT_FOUND,https://www.indeed.com/rc/clk?jk=632ce24625fbe2aa&fccid=2dd390c3a48a7ed0&vjs=3,9 days ago
10,p_802beea8c06b197f,Chicago,data+engineer,Data Engineer,Molex,"Chicago, IL 60606 (Loop area)",Build and maintain a robust data collection system that reaches across multiple sources and data marts. Molex is looking for a Data Engineer for our real-time...,NOT_FOUND,https://www.indeed.com/rc/clk?jk=802beea8c06b197f&fccid=de113fe345574782&vjs=3,5 days ago
11,p_8768876fe19429a0,Chicago,data+engineer,Data Engineer,United Airlines Inc.,"Chicago, IL 60601 (Loop area)","Test, develop, and advice on best practices for data engineering and data science projects. Work with different teams of data scientists, engineers, and...",NOT_FOUND,https://www.indeed.com/rc/clk?jk=8768876fe19429a0&fccid=e69f69636a9997cd&vjs=3,6 days ago
12,p_ae4a0328702cef77,Chicago,data+engineer,Data Processing Engineer (Junior),The Core Organization,"Elmhurst, IL 60126","Data Processing Engineer (Junior)*. Our engineers are responsible for completing daily data processing activities, including postal processing, report creation...","
                $30,000 - $45,000 a year",https://www.indeed.com/company/The-Core-Organization/jobs/Data-Processing-Engineer-ae4a0328702cef77?fccid=48d688e68deed227&vjs=3,9 days ago
13,p_6644200a31fc139e,Chicago,data+engineer,Data Engineer - University Students,McKinsey & Company,"Chicago, IL","You will provide analysis, analytical modeling, and/or visualization of data sets using relevant data tools. You'll apply your understanding of client data sets...",NOT_FOUND,https://www.indeed.com/rc/clk?jk=6644200a31fc139e&fccid=6576e7250aa78c3c&vjs=3,13 days ago
14,p_454e690016aa0e33,Chicago,data+engineer,"Intern, Data Engineer",American Medical Association,"Chicago, IL 60654 (Loop area)","Intern, Data Engineer. General knowledge of transactional data processing, ETL, data warehouse, data mart, and operational reporting solutions a plus....",NOT_FOUND,https://www.indeed.com/rc/clk?jk=454e690016aa0e33&fccid=6339ee308067b8f2&vjs=3,5 days ago
15,p_9c7448e1edf13198,Chicago,data+engineer,Data Engineer - Hux,Deloitte,"Chicago, IL 60606 (Loop area)","Hux Data Engineer. Industry-specific marketing data. Design and implements data tools for analytics and data scientist team members to help them in building,...",NOT_FOUND,https://www.indeed.com/rc/clk?jk=9c7448e1edf13198&fccid=9e215d88a6b33622&vjs=3,4 days ago
16,p_0898a319aed20fa2,Chicago,data+engineer,"Sr Data Engineer, Zoro",Zoro Tools,"Chicago, IL 60654 (Loop area)",Senior Data Engineer. Expert knowledge of data modeling concepts and data relationships. Data Pipeline development:....,NOT_FOUND,https://www.indeed.com/rc/clk?jk=0898a319aed20fa2&fccid=80bd79d813274903&vjs=3,2 days ago
17,p_39b9db41c461b1b8,Chicago,data+engineer,Data Engineer - Summer Intern - University Students,McKinsey & Company,"Chicago, IL","You will provide analysis, analytical modeling, and/or visualization of data sets using relevant data tools. You'll apply your understanding of client data sets...",NOT_FOUND,https://www.indeed.com/rc/clk?jk=39b9db41c461b1b8&fccid=6576e7250aa78c3c&vjs=3,13 days ago
18,p_d739f728b14e92ef,Chicago,data+engineer,Data Support Analyst - Entry-Level - Technology Startup,Enterprise Peak,"Chicago, IL",Data Support Analyst Responsibilities:. The Data Support Analyst will join our data engineering team and will be responsible for mapping out high-tech labor...,"
                $18 - $26 an hour (Indeed est.)",https://www.indeed.com/company/Enterprise-Peak/jobs/Data-Support-Analyst-d739f728b14e92ef?fccid=01046231f71a939f&vjs=3,30+ days ago
19,pj_be4baee9ce3c6f60,Chicago,data+engineer,Data/Business Intelligence Engineer,Comcast,NOT_FOUND,"Experienced in Multi-Dimensional Data Warehouse design and development, creating tables, procedures, and views to remodel the transactional data to the data...","
                $100,000 - $142,000 a year (Indeed est.)",https://www.indeed.com/pagead/clk?mo=r&ad=-6NYlbfkN0CTJZWBuN5Z7VABbDQwOGREYCrV5vLdkzI2rEcq75dEoEL4JpLGB956cHerkOvzgatvRmjMFp_6goPpwRReHWylp9Xy1Jeu1UpCicIYvUyrkIxPhPJbDmH547pR_phk1t9FH5G5AQyQqV8taGbzGQ9i2ieTvL4or-26-mR2nGZbZVbVAtq38b0_wkm699_OGntZqzNbfmDAFKL_Nq0Tppwe9KhGN9S-ba6vavCerS2B9HZ4sGkDbivXpSt_obDKKP5t3cEvAqmTaVitMH8RQc4OPdLqAm23NtBYWC4gO7ud-EcyVkVYkpV4ZlswUdKdMX73iYpnFoIlAZ6FK-p_ytXcuaa6te1QPEwdJYNnTjbbI2PhznNXNjeeKc5dirYTxgizZKXCRj933ee9cjSYu098VrAuBBzYLkf-tAuZ69WBrg==&p=18&fvj=0&vjs=3,NOT_FOUND
20,pj_ae4a0328702cef77,Chicago,data+engineer,Data Processing Engineer (Junior),The Core Organization,NOT_FOUND,"Data Processing Engineer (Junior)*. Our engineers are responsible for completing daily data processing activities, including postal processing, report creation...","
                $30,000 - $45,000 a year",https://www.indeed.com/pagead/clk?mo=r&ad=-6NYlbfkN0D109no4bUrp723nlI1tSXCTvb0XOsNkQXy7jovH4rRrY1-IyUTA5v_KG5b-WEFtyHRZQ67fO6AnuNZ1djwIac_QwQBvD04PcLdtQXglzpm90PmI4E8ztEhyf35Y_N-SOOVEglttXij5t60vF86E4LIk28httRLgfBaq3k3SvwLVLjSP-_cLbYwPhtfkSnOTFuDlQ9Nwo2pvSilzAqmq2xA5_WCusmIskboTdjxpjco5QmJAQEBRfWNLFsYracyyuaa2XgRqSPYKT6dPlZwTM2a-ucdViGENMfoqKERjUhIseZgqq026JT_HKG6kKaghAgk5vC_DRpacQT4aANh1RE-8IXfuYAMxKUpHAocGs4x6pSiwkmNoTT7hXMD4i6F_sZqm_3wiGYB-d896kSobEe1OYi_5-yd1pMqDgrG3T_mjQQGd_Og7S-Ti96lMqYran4=&p=0&fvj=1&vjs=3,NOT_FOUND
21,pj_be4baee9ce3c6f60,Chicago,data+engineer,Data/Business Intelligence Engineer,Comcast,NOT_FOUND,"Experienced in Multi-Dimensional Data Warehouse design and development, creating tables, procedures, and views to remodel the transactional data to the data...",NOT_FOUND,https://www.indeed.com/pagead/clk?mo=r&ad=-6NYlbfkN0CTJZWBuN5Z7VABbDQwOGREYCrV5vLdkzI2rEcq75dEoEL4JpLGB956cHerkOvzgatvRmjMFp_6goPpwRReHWylp9Xy1Jeu1UpCicIYvUyrkIxPhPJbDmH547pR_phk1t9FH5G5AQyQqcu4XrOSqgbqz5I6D7j2T3xSPr98ok6pUDXjh-PNGuuCFdHd-Guc9M7dX70X2OUP4Nnrvk6B5pE_-MNpGG8C0ZehYoY1jvCg9PnvB3OuMSB4Jj9qJtTCH4-bB9Hcp3FVeVnGrooYOrroTNpLJAgUH9xK7FvlPIzv75sGTPPXCAfoRWP5GEkbbin86BnAZAXViWASu-7ddiPHuLZprkFA31iRIenkVPSMkMQdx8XRPiWDQYtzr9TYwjQVBeGLqAS4B1kAVP1wiIIKdfLjLVTCLCbQn4dHXIq45w==&p=1&fvj=0&vjs=3,NOT_FOUND
22,pj_5ccf5672b182ceb5,Chicago,data+engineer,Data Engineer,PNC Financial Services Group,NOT_FOUND,"Data Architecture - Basic Experience. As a Data Engineer (hadoop) within PNC's Technology and Innovation organization, can be based in Pittsburgh, PA;...",NOT_FOUND,https://www.indeed.com/pagead/clk?mo=r&ad=-6NYlbfkN0AMofH_6zXbiqn6xehDj89HQNfpf30LHk40Y3Yl5cZTpi6PEICC7pMg_HwfIsLXdbvkgu7vi_4YTkgWbL4IKBUhhQ7ZuqFeuMv7_baf-YYF56L64RzKVhfQGZmOphXDIi4FX7Ol2hMoLOll6hIjxNXjBrWzb2jUj4HaZfvsS2ea-6EPOvvvrCa1FgrUBxd3M0UT5jyY-7KTYYl3Tys5kPT8crnVEnP29q2q1tRlnUGcvL9iWasjWNp0aKo6ZmfNxUdXHx-eThWKALRu1sRhH-XWK21bpLWakuD1nhn5S5acX8hv6DeWAf8-H3vyxIVgcJdiTw8X8pa8PgUIzUVnrLz-cDDtPU7HsJ1Armi8bsFDj-LiaoW_nfR0YQI2sK7b5EVRgywm9gSIdsZtbyzZAcl7w0p4iUHrBmY=&p=2&fvj=0&vjs=3,2 days ago
23,pj_7f40752a3ac8760e,Chicago,data+engineer,Associate Engineer,"Reserve Advisors, Inc.",NOT_FOUND,"Become familiarized with the schedule, routine and work process of Associate Engineers, Engineers, Senior Engineers and the Regional Engineering Manager....",NOT_FOUND,https://www.indeed.com/pagead/clk?mo=r&ad=-6NYlbfkN0BFkco8LjqT1MbDJiWVxr_1paC57h1MBS10z5Tk1ROgt-jslHd9gnKOLDkjGxJO6o0M-CU7velqRChL-wKiA0gdnvEM5BWYA-gzYPJYz2T04AyizCvSUDYFPyVSygmfKxxQk3DjUIxeihwpzK7dsKjyXi-5Y-2htb44lCsFtqgRGfslP3pj8VO4ZAI3ibGxHXnMYlok6cPYjVdDLR8ndSk8ncEgSWpFvBrpX6rwJTSUNJg7Y-rb0Lc0ux7-rW3QtRclfwD7fzDm7uGhUnsQLeLVKr5Kua_vlinwY-0QJ5Ayuah34zeKXA3bLRn3vUyfSeNVKs6leJdIVwflx4CgQzHF1UulRl0Ll-pe3U5B9KA-I0rdPcHW6mno57ED4ImWyA88_ADF3WpeVmm4E5T5n1kBvpf7PTwwMnMbVDGu0bWevZ6NHcSp3Jg5&p=3&fvj=1&vjs=3,NOT_FOUND
24,pj_7c48becb5f622b2e,Chicago,data+engineer,SQL Server Data Engineer,Paul May & Associates,NOT_FOUND,"SQL Server Data Engineer. Data Engineer’s work in conjunction with Software Engineers, DBA’s, Business Analysts, Quality Assurance and business owners....","
                $100,000 - $145,000 a year",https://www.indeed.com/pagead/clk?mo=r&ad=-6NYlbfkN0AtmmgL-6xvNJ2TgfBOZULzFUyk3B45PtfzaCI94ECTxCQ4YqVW-kqsqhBVKZtXnQdzzbF-I5KZVa_5WBIpDW_npQKNek2lnOsdrW2ZwfNcMSGFJEUQPk42GN_t8dWeCXFy0zdg3awWmzCSTqqti4sb13h_Nj3UGIOcOmhijIPGGN8WXjYSEGeB0QU6lZeVmUBe3-qJlmKQFHc-h0qn_9XNUY2r5uGJ_CntpX1y-3L_x9mPxiZIiVVEyFwrSFd63VNCoz9eIZhwT7qZOx0OWCb5H66Ch_VyFF8toNM3urMYY9mZqOvlYn43bSd-kJ9hBA_UTuaCaGsg3GHme5jDbvyOIekx-9uU8L4V14bpy3sJmmHHhseMkDmqp67QkIUSzXc4zgHVEX5I16Mm1CiRcktRBQwo7SUFmXHxV0-kmpOVPp6IRo5AWi4K9PuiBjQwarT5U_eE41I1UA==&p=4&fvj=1&vjs=3,NOT_FOUND
25,pj_c632718fa83e640a,Chicago,data+engineer,Lead Data Engineer,HNI Corporation,NOT_FOUND,"As a member of the Decision Science team located in Chicago, the Lead Data Engineer will play a crucial role in building HNI’s data engineering team....",NOT_FOUND,https://www.indeed.com/pagead/clk?mo=r&ad=-6NYlbfkN0Atbdg0bKLfsMf-XrvW-mGXYBBmUmFJMxfHxiCcZI386bZZErgOHOnp8FGa_pu4CvDiJ18akOtGXIcWt4o_UOHlr_NHfLUXRM2vfIvrSc12_M5D0ryuBSpn2sRGnfbPTkizXFvjuUoCFjHFN8NI1b_tO8rYDq_4PTkeBp7mNiNM70j19_6jEzahC9S-a9ruPOU7DRiIShrY3i1wyP7EkDVcKZks60UJs0gZ1C27JAWqafl5RlqGAw20m3WBV1a4rdUHY3McIMpUJVUIo6jsi9UeOFHyP6azk6AlA6YrMnNoL2uoGz6l4m2haCBtHajcVPAb271yMkCn-OGAyFXOgDtmN7wQT7DhgCIviOvrL48bfb_d9WhA8DNWmxfgosui4oPj-vi8F1TCtjd_v5h2lDQBgE523uqo2W5a0t9RuhPryy6N8jVEP-Li&p=5&fvj=1&vjs=3,NOT_FOUND
26,pj_2c215f92714781ae,Chicago,data+engineer,"""Guide"" Telephone Representative (Remote)",ASSURANCE,NOT_FOUND,"Our team of engineers, data scientists, marketers, architects, and designers are building systems using advanced science to make humans better....","
                $15 - $45 an hour",https://www.indeed.com/pagead/clk?mo=r&ad=-6NYlbfkN0Ay34pLxNpM2b2APydG9FPHc7HhqjeNrk9_gDXaaFM3GhdpWVlroe6JqlZhsdxePfrzEmlIgeNT-LieXQ_0S4twn9Vntij7WrPilgoX9MGRYct7gZaSdEdS8GDbJULchIY1I4N3wXqKV1nSAlQCg_eCpBExIpCpGLrditpkG3WS4xg_18TbD5GXkLUvYW_ij0o4MzuoTfGk_uN_in4bTKmrnOAhHd_p_FzPvXfAvw5Bp5wLsy27KLt0kI_RvOx0k-tcDpsoEH31LwnBTJGcqpJzuhCeUn4VUT_o5Xd4cdfREjFvbiZlk2uxcQrKziHN3i-WjKKlFgfma6Rg9GojjRLTJjjno2t0Rh8g8AM8BiYUwW9HfxB4AoGa15ny5Zy5keqRP4l2U83M8LnvLRwXVXMYetRGCjGmPwd640d7e-CJZd5a90DJ91Pg&p=6&fvj=1&vjs=3,NOT_FOUND
27,p_802beea8c06b197f,Chicago,data+engineer,Data Engineer,Molex,"Chicago, IL 60606 (Loop area)",Build and maintain a robust data collection system that reaches across multiple sources and data marts. Molex is looking for a Data Engineer for our real-time...,NOT_FOUND,https://www.indeed.com/rc/clk?jk=802beea8c06b197f&fccid=de113fe345574782&vjs=3,5 days ago
28,p_e6c2ad01d711eee3,Chicago,data+engineer,Associate Information Security Data Engineer,Federal Reserve Bank of Chicago,"Chicago, IL 60604 (Loop area)","This Associate IS Data Engineer role on our operations team involves managing our machine data collection & analysis platforms, onboarding data and providing...",NOT_FOUND,https://www.indeed.com/rc/clk?jk=e6c2ad01d711eee3&fccid=d591aa7108fe9a20&vjs=3,2 days ago
29,p_9c7448e1edf13198,Chicago,data+engineer,Data Engineer - Hux,Deloitte,"Chicago, IL 60606 (Loop area)","Hux Data Engineer. Industry-specific marketing data. Design and implements data tools for analytics and data scientist team members to help them in building,...",NOT_FOUND,https://www.indeed.com/rc/clk?jk=9c7448e1edf13198&fccid=9e215d88a6b33622&vjs=3,4 days ago
30,p_d739f728b14e92ef,Chicago,data+engineer,Data Support Analyst - Entry-Level - Technology Startup,Enterprise Peak,"Chicago, IL",Data Support Analyst Responsibilities:. The Data Support Analyst will join our data engineering team and will be responsible for mapping out high-tech labor...,NOT_FOUND,https://www.indeed.com/company/Enterprise-Peak/jobs/Data-Support-Analyst-d739f728b14e92ef?fccid=01046231f71a939f&vjs=3,30+ days ago
31,p_72b410f50c54fe18,Chicago,data+engineer,Senior Data Engineer,"Sofbang, LLC","Chicago, IL","Senior Data Engineer*. You have experience building and maintaining ETLs, data pipelines, and data models. Strong understanding of data warehousing concepts....",NOT_FOUND,https://www.indeed.com/company/Sofbang/jobs/Senior-Data-Engineer-72b410f50c54fe18?fccid=48e3b538d312ada7&vjs=3,2 days ago
32,p_c0c2e3189392cf9c,Chicago,data+engineer,"Applied Data Engineer, ETL",Civis Analytics,"Chicago, IL","Working on data pipelines in support of data analytics or data science applications. Experience with data quality processes, data quality checks, validations,...",NOT_FOUND,https://www.indeed.com/rc/clk?jk=c0c2e3189392cf9c&fccid=85806092f576a90e&vjs=3,11 days ago
33,p_b6ee6e258ede766e,Chicago,data+engineer,Data Engineer,divvyDOSE,"Chicago, IL","Build and deploy the infrastructure required for optimal extraction, transformation, and loading of data from a wide variety of data sources....","
                $75,000 - $120,000 a year",https://www.indeed.com/rc/clk?jk=b6ee6e258ede766e&fccid=597ef0e9ad468a41&vjs=3,27 days ago
34,p_1081571975aa376b,Chicago,data+engineer,Data Engineer,Omnitracs,"Chicago, IL 60601 (Loop area)","As a Data Engineer, you will have a heavy focus on designing the solutions to deliver data products. As a Data Engineer, you will be responsible for data...",NOT_FOUND,https://www.indeed.com/rc/clk?jk=1081571975aa376b&fccid=dec008cfb3e077e0&vjs=3,9 days ago
35,p_60ba2ae4a517cd54,Chicago,data+engineer,Data Engineer,SIRVA,"Oakbrook Terrace, IL","Data engineers also be responsible to ensure compliance with data governance and data security requirements while creating, improving and operationalizing these...",NOT_FOUND,https://www.indeed.com/rc/clk?jk=60ba2ae4a517cd54&fccid=eafcca0eeeb48db6&vjs=3,10 days ago
36,p_6b11a2c2e2d6a4f7,Chicago,data+engineer,Wireless/Telecom Engineer - Paid Summer Internship,Further Enterprise Solutions,"Chicago, IL","The outdoor data collection is part of the job, but then the other parts will consist of indoor data testing/data collection, as well as the set-up outdoors for...","
                $20 - $22 an hour",https://www.indeed.com/rc/clk?jk=6b11a2c2e2d6a4f7&fccid=d3a565a3b75e8fb6&vjs=3,9 days ago
37,pj_4eb4a3b474554cff,Chicago,data+engineer,Sr. Data Engineer,Echo Global Logistics,NOT_FOUND,"Data Engineer's work in conjunction with Software Engineers, DBA's, Business Analysts, Quality Assurance and business owners....",NOT_FOUND,https://www.indeed.com/pagead/clk?mo=r&ad=-6NYlbfkN0BTjlGj5JvLfH__h7ZRGeXDIcGXy_3l5WUsOynPPMXwb1WFCX8IUjj39FR922UkfvttvhoYJSd-Y5JyFHDVoRkqYH0BQ_n3-Tzemr4_p8mBHMMJBSsyWPFL_PKBWuov6zmIiglU0TLh094CVJizK7qkn5YpWGuVlanzc4-VaNKhxi4kjE-xi2oUltxqkWKVetrXMrXRGtuE1R8PSdlTLtE4hLr_HmHTohLL4NV0etll3twgSWgkdry5dL5qHLBGUbmlZDmd3CNR2C8_4Nf7fqJmbe2kDlMHCLBKI64hWsCOOR27LkgBKfv7Yc2GSgmtecvPXnY2cwmo4AcPMhz7iv-SYOqJFIVQH8QzcCG_dVQ9kwGVta8IvN0lAJv8Z-9KLRw=&p=17&fvj=0&vjs=3,NOT_FOUND
38,pj_855752100bbb0729,Chicago,data+engineer,Data Engineer,"SMS Assist, LLC",NOT_FOUND,"The Data Engineer role has to work across the following areas:. The Data Engineer is responsible for applying your expertise in quantitative analysis, database...",NOT_FOUND,https://www.indeed.com/pagead/clk?mo=r&ad=-6NYlbfkN0Azf24ceGmJeoddGoGdtujU3GsUDah2gM-7e14s1pjaUtWzN6BvzuI23xYyb0EFlptM3Z-IlhvplofC_UCW5N1BylJ09zu1Mhg-7Pl0_MBfxJYc-4mZvrdPYCjzoVIQquk2Fjdx89yWB2mykO63U1xDwHfXJW9RTh1XB64f5JP_yFZxyj2s78aiU6Pc9zCT9O3NJUc76I4FL92xb4GqkOCcXxs4ocCYAgefVfdShyiDa5WYgLjn3akbABkEtKg_2Ixv_R2daxfqM5MAFfoHvH6fJ8kSJzO_8HJH1jqHqyixCHZWefKSu4XAGuPahzOnTLJu35yUqlqSpMIdLCDIoa7me5xrpUp5v9SZqL3lI5XDy6__GOPkS2nNhaeO3cadXdXGajrqAVfJkYoVQKvMZrhBplqikePmAFKXzHt2y6f2BhZj69Y3J8NK-uR5vUBoENTpJDmYgdFeJfgTZb_MPYKgsq09yW9nfJg8jz8tn3wunS3d43BrEOc1IdLyuwUBZAXXkokGqPHmeuo0h3ug3bzZeQhs0PRcu52RV7xU5xheKw==&p=18&fvj=0&vjs=3,NOT_FOUND
39,pj_c632718fa83e640a,Chicago,data+engineer,Lead Data Engineer,HNI Corporation,NOT_FOUND,"As a member of the Decision Science team located in Chicago, the Lead Data Engineer will play a crucial role in building HNI’s data engineering team....",NOT_FOUND,https://www.indeed.com/pagead/clk?mo=r&ad=-6NYlbfkN0Atbdg0bKLfsMf-XrvW-mGXYBBmUmFJMxfHxiCcZI386bZZErgOHOnp8FGa_pu4CvDiJ18akOtGXIcWt4o_UOHlr_NHfLUXRM2vfIvrSc12_M5D0ryuBSpn2sRGnfbPTkizXFvjuUoCFjHFN8NI1b_tO8rYDq_4PTldYxAnjL28nUZ468JlrA3n1XBXa9XTsyRyzHr95VCWr5x_mq9JrAjQdR8St4t4iagUbxG8M6rgI4GKFdfKCegJ679e99vsyJ8lZtAFWYqGJB7OYksajYGeOVuEusDWXwx_7FSuMFa4VWOzU4Q4UCUhYnFKShygwCkanv0s91JXUtKh8bgC4QmymsnQzeZK0A_JOPNmqzzQPgpkLnFyTIKHrV96GyDzRYv1OyLLWwpKyl0FducE9QKwuIG2AXtAXnLl5izfx03hA5V_sK8a6az1&p=0&fvj=1&vjs=3,NOT_FOUND
40,pj_ebdf4b028d05deae,Chicago,data+engineer,"Big Data Engineer, Senior","SMS Assist, LLC",NOT_FOUND,"The Big Data Engineer is responsible for building scalable data platforms, and large-scale processing systems that enable advanced analytics and support data...",NOT_FOUND,https://www.indeed.com/pagead/clk?mo=r&ad=-6NYlbfkN0Azf24ceGmJeoddGoGdtujU3GsUDah2gM-7e14s1pjaUtWzN6BvzuI23xYyb0EFlptM3Z-IlhvplqtV8Ot1z61mB95k7Jtk5bxTRltq9PmlAuQMXnqjKZzKhXgRmqXichLLjFoHPEfoKYFzfDcDfwC9NjKNqomUEhN4RwBfziIvyXhPsOG0pTqj0mz26bT8iAR2qwZ-l9F__LqcbBqF0_N4i95kSYMuq5ruml1hAw_pAzMLXVKQDUEAd7dm5DftLfqfv_9gaCo7P8xYrdjW4JO69mdO9_HuKjrbWlLoxS5eAS92-nPjCYfSCSl_2qP1vL5tF_V1b_DT6LjXReXwJ41KEnXUZnx4ewzLdSQ8NDSP1SHOaAvtUQwcJS0vJWEdEpzjeDVnB7xyeechVVigR4qu-2574oi5YdNNUjIJRGt-x6rlNmad-mJnhK3_rlorAcSAZ8Tsvh1N0aRXQr4GigmMXRfwKu0GwgRuZ5_452-XmOm-8-8LKhJCCwc_1Z8PkpXzr2VLikpwx2TcnDCRk1Wy51sm27duVQFdLECP5tpS1g==&p=1&fvj=0&vjs=3,NOT_FOUND
41,pj_855752100bbb0729,Chicago,data+engineer,Data Engineer,"SMS Assist, LLC",NOT_FOUND,"The Data Engineer role has to work across the following areas:. The Data Engineer is responsible for applying your expertise in quantitative analysis, database...",NOT_FOUND,https://www.indeed.com/pagead/clk?mo=r&ad=-6NYlbfkN0Azf24ceGmJeoddGoGdtujU3GsUDah2gM-7e14s1pjaUtWzN6BvzuI23xYyb0EFlptM3Z-IlhvplofC_UCW5N1BylJ09zu1Mhg-7Pl0_MBfxJYc-4mZvrdPYCjzoVIQquk2Fjdx89yWB2mykO63U1xDRNhBdobvmqKHHm-VCDTuq1dBgWQAC0iG1NTNGZcqVOBjnaYLjcpQ2JiaZjtlemuKmgrkCakqMG99qm6IFvgvP0iuSKG6fWo5LMv634aRgj4xwETnoNMs2UzVVENwyYbxwDEjL6duyKuWi5_MNjvchmRxW2cxRVYdSEZuqzZWtn29JohYf3dP05czr79HGJUNVwNLyPBGjfewkO-P2kxNeg9hI_5ochMjmDw_MSB4zAZM5KIfJZ325DqeRoIpHkP1nu_k5UjPJdNSgzGIVGu-Lxf-oNz3JdPgUOkvRrCHNqGoGtfNzWNVDE-Yr7P8M7WJghhe7oJouJgKLsKxyeoVq1JGaJUEkCMAzD7CiFGi4sck1ApHiELQXKn2uvqvL2HRiIo2mkafttQjjfnS3wNsnw==&p=2&fvj=0&vjs=3,NOT_FOUND
42,pj_7c48becb5f622b2e,Chicago,data+engineer,SQL Server Data Engineer,Paul May & Associates,NOT_FOUND,"SQL Server Data Engineer. Data Engineer’s work in conjunction with Software Engineers, DBA’s, Business Analysts, Quality Assurance and business owners....","
                $100,000 - $145,000 a year",https://www.indeed.com/pagead/clk?mo=r&ad=-6NYlbfkN0AtmmgL-6xvNJ2TgfBOZULzFUyk3B45PtfzaCI94ECTxCQ4YqVW-kqsqhBVKZtXnQdzzbF-I5KZVa_5WBIpDW_npQKNek2lnOsdrW2ZwfNcMSGFJEUQPk42GN_t8dWeCXFy0zdg3awWmzCSTqqti4sbnLsJEcvQaAPzPGJ06xw3RpLNpWe5-h_SRYSGFMrigy-p8ixy5ApMS4ZyLP0cLcRuusgvHAilX7NrWKJ7cwtIzhyU6rNbhKSz1YxJTbAPshFT1pnWML6b8jqd-okf0qBXwBG351LWXSEHb1NaVPyNSwM77F_0QN5xXfdqDhqiHoDXtx3O1XdtWrAXEReZ6PNyJElPhYcgQ1pnbmwciwQkYvk7wqYSkJVm0x4SZZ_g-XloDMlRFm8d6Y6tt8KNe3oj7uSb0NeCqqH1OD4oEHC2ymHiAF5OBELTWjH_9ZrVNdV-Ti9TbuaMwA==&p=3&fvj=1&vjs=3,NOT_FOUND
