,unique_id,city,job_qry,job_title,company_name,location,summary,salary,link,date
261,pj_3df7033bbe451c67,Boston,data+engineer,SENIOR DATA ENGINEER,Benefits Science Technologies,NOT_FOUND,Improve data validation and data quality monitoring. Data security and encryption:. We are looking for a passionate Senior Data Engineer to join us in building...,"
                $120,000 - $150,000 a year",https://www.indeed.com/pagead/clk?mo=r&ad=-6NYlbfkN0Bo83FT8hN2PCWuwik2MfjabT6etR7Ty3Eig64gwmZDXFBwUJEQdWreFWKElPOydQh-Q_EzkiS6fcSmglBjKMPhzIwwN63qzrSaICM5nTLmslg7L7pncS_gEyhGyALI7S84-ugBTEmzcXrHyJVVgO1pdoCBV1mVQgBo9uX_8aNhOYFhTduTujgB139bcpQM8dXXmv194A6JO5cZixfcQjnsMSvzjuvBNfSN0YjFQOP3vETsTAEj3JTMq_DVwYNfLlbMushfE6bI9brSgqDKyJ5YnDUo2yY7YaE167KcFqB27EwJqqqln1A6XZBSsAniUCcIHZ8KVhvwRs0VcIAHKtWG0yOUmPQZFNNjenBhl315xdu1Os5GH749AE5Pp0236gXD-un4FMmMCqgPLa9hB2lw3T3l4iqVlygbkQHSm1D4MxyLXUnuMf4_&p=16&fvj=1&vjs=3,NOT_FOUND
262,pj_c98d1ce3ee653cc4,Boston,data+engineer,Junior Helpdesk Support Engineer,"Bay State IT, Inc.",NOT_FOUND,Communicate with Helpdesk/Field Engineers. Some analytical ability is required in order to gather and interpret data in situations where the problems are...,"
                $38,000 - $44,000 a year",https://www.indeed.com/pagead/clk?mo=r&ad=-6NYlbfkN0Aq7V8qbMAPCPg74Ici3Ykfl8KCDQgSE3oM5G8LA-BPGL4P7_NeGmqL6h56dgQ3yNc-yB19iAVZTppDacNzSLfgmnOkXuTdxUZimUbUSIOtclpF8Q6JmzeexoW_JNxtMhavoVKqDuuK7mtrLlFitj7PR9pnsn5fgt120Nwb9t_blOEbbd8enpnplMDJAjTa4qna_yHKnPj1eR4YnrEh_x7QvwCGS1tDCSvEEkfrsAH1yrYsFokfIOGLxp9kYdP_NJNit69dUWcX1NZ8EBeOyAL16mgX3ZjDJD0YVmyg3dk44rhXjKU7i3e5q7qsIeQbQfueDvamx0NIihLe45Q31zk8o77ZN1S7jKL4WnPcblkUPQ3aCE5h2MQx7RFzgkZ2i_jJYUhsRGoI643l7wgyaHhg2Ip3uImxscUs0pUndv2GlbzIUDzIzjEqTb_0pjwFs_U=&p=17&fvj=1&vjs=3,NOT_FOUND
263,pj_c3bc11267ccede5a,Boston,data+engineer,Data Engineer,Sea Machines Robotics Inc.,NOT_FOUND,"Manage and perform data analysis to identify data quality issues. In-depth understanding of database design and structure principles, data management...",NOT_FOUND,https://www.indeed.com/pagead/clk?mo=r&ad=-6NYlbfkN0AHdFIJfBLGYbx_TzBCBsgbK0Due77H36xmGRpY2MfZsPwTPTh4aSQRFNCGEArHnMvviCNe5JnuWNMqtdZcBvIfU2yZuPy0QwO0-wkoQzNojCcEfroTLtF0vikT6bN9EMogcSG1Aq6SrRcAZCVGhDs0Ix9Rr1aQ5j22Td2-QZgg63HwN8MWAUOddmGnYn2Km77AXaHnmKgLlIEieNTsL4Je_Bc1MQY4LOL5S4NVHPp6tVBe8FI4Zp1WqgWlzOppxTm0lY6n7fe1J-bYyWrfArv_n9iahDb327OzhmtuylWeS525PujEmtJmxbdOfcAj_7tEcHM_lsli-dbnmdAx-ea62auDgoAd_UnkD4MTmM9gTqj-YLN_z6FQrLkTolY5hMqM84kvOTI8Bmld3X0BnSrYHwUJTmcTpUmLPqcKPgz5vA==&p=18&fvj=1&vjs=3,NOT_FOUND
264,pj_8eee714b00fb9f97,Boston,data+engineer,Operations Associate,InsideTracker,NOT_FOUND,"Track and report business data. You will be part of a dynamic team of customer success professionals, sales executives, nutritionists, and software engineers...",NOT_FOUND,https://www.indeed.com/pagead/clk?mo=r&ad=-6NYlbfkN0Dwg_2IOKdKJg_acPgbKTyChScr5ouNCWTxgJK0kim5HvhhXXVQt0LvfqTZblqbnuy6Kij3JvENaWDix8wOFysza0s_0XDju1t9R0VfqMhWz3FYhKD_6wATgZFHByeZ3Nqk8KcCoiJfy5zQ8dTAqhFTGnNVCjmVCJlaIDdjzvRHZNjcPMNI13kG2xzy1MnZlq39Bgcj92IwhHix-8NvMZUJISD-teCRL2qTo9XBT8kEzHtpk1B7udQnT29IdITErKOgOTowZZAwf8CbZl1gvpJXpBQrRwXVhpYG_Y-O5G8SRWxIZZ8No6EPWlkQglZl6hRik5Md2n5eIKdXxm6rC98d8UFL7u6iMNRdLOTYap7lA9KLiD--ZwDvx8ou77U0PDE=&p=0&fvj=1&vjs=3,3 days ago
265,p_1a8ca21ccfa2c9f3,Boston,data+engineer,Senior Data Engineer,Genscape Careers,"Boston, MA","You will be developing data acquisition, data cataloging and deliver systems where speed of deliver of data is of crucial importance You will work in a highly...",NOT_FOUND,https://www.indeed.com/rc/clk?jk=1a8ca21ccfa2c9f3&fccid=9b5f136fda04d3d6&vjs=3,30+ days ago
266,p_dc135c8487fbca01,Boston,data+engineer,Senior Data Quality Analyst,Bose,"Boston, MA",Provide data quality requirements and business rules to be implemented by data quality engineer by translating business problems into actionable data quality...,NOT_FOUND,https://www.indeed.com/rc/clk?jk=dc135c8487fbca01&fccid=42f1e4ca72488e15&vjs=3,5 months ago
267,p_6f8388afb0134034,Boston,data+engineer,Senior Big Data Engineer,TTEC,"Burlington, MA","Senior Big Data Engineer - Burlington, MA. Engineer - Product development. Understanding of complex data flows, identification of data processing bottlenecks...",NOT_FOUND,https://www.indeed.com/rc/clk?jk=6f8388afb0134034&fccid=4be57509a4916871&vjs=3,7 days ago
268,p_28f2ca52606791a6,Boston,data+engineer,Sr. Data Engineer,MassMutual,"Boston, MA","Our ideal Advanced Data Engineer is a collaborative leader skilled in data analytics, data modeling, and database design....",NOT_FOUND,https://www.indeed.com/rc/clk?jk=28f2ca52606791a6&fccid=acf786d7ca32d66d&vjs=3,4 months ago
269,p_d8947bf9a4992eb8,Boston,data+engineer,Engineering Leadership,HubSpot,"Cambridge, MA 02141 (East Cambridge area)","The HubSpot Product team is made of more than 500 Engineers, Designers, Product Managers, and Researchers....",NOT_FOUND,https://www.indeed.com/rc/clk?jk=d8947bf9a4992eb8&fccid=21bb811abc2058c6&vjs=3,5 months ago
270,p_8390930ce83308a2,Boston,data+engineer,"Data Engineer, Telecom",DataRobot,"Boston, MA 02109 (Central area)","Integrating the code, produced by data scientists, into data pipelines. As part of your work, you will be interacting with data scientists, software engineers,...",NOT_FOUND,https://www.indeed.com/rc/clk?jk=8390930ce83308a2&fccid=ccacdb1cb7d4a077&vjs=3,5 months ago
271,p_af52578d2961cf6d,Boston,data+engineer,Big Data Engineer,Avanade,"Boston, MA","1,000 data engineers. Deep experience in developing data processing tasks using PySpark such as reading data from external sources, merge data, perform data...",NOT_FOUND,https://www.indeed.com/rc/clk?jk=af52578d2961cf6d&fccid=5386281035076fdf&vjs=3,2 days ago
272,p_ad09b932583bb233,Boston,data+engineer,Director/VP of Data Engineering and Analytics,COTA,"Boston, MA","Manage cross-functional team of data engineers, analysts, and data scientists. VP of Data Engineering and Analytics....",NOT_FOUND,https://www.indeed.com/rc/clk?jk=ad09b932583bb233&fccid=0950181599f58650&vjs=3,4 days ago
273,p_4857f6d079e9cf9c,Boston,data+engineer,"Data Platform, Team Lead",Toast,"Boston, MA 02115 (Fenway-Kenmore area)","The Data Platform team is building the massively-scalable Spark, Avro and Parquet based streaming data plane built on AWS that will meet this goal....",NOT_FOUND,https://www.indeed.com/rc/clk?jk=4857f6d079e9cf9c&fccid=d1281a9abeab94cd&vjs=3,30+ days ago
274,pj_d400de46a546e4f2,Boston,data+engineer,Sales Engineer (SaaS/Martech),BlueConic,NOT_FOUND,Customer Data Platforms. 5+ years’ experience as a (pre-)sales engineer working with enterprise SaaS product(s)....,NOT_FOUND,https://www.indeed.com/pagead/clk?mo=r&ad=-6NYlbfkN0BIXk-KjEr2lbPrxl5QqpqLDYgEE8AgSm6_3MFsEPgmh5EuAkTrTghO57EFuI8jVmq8TyQje6-qT3rCi6xD2Drev07ND2BCRXojeBDdBi5157EJWHUHOCirRPPxok8QRKnL9KyZPWBIOUwZzfAQKgVX-hmbW67TGFXjzwJM7RZCdzFSWK2iVQBe0w9fWKMUw6RJ3ESg3bXFu8MkxunCsBXfkkNVU1qEMZkurfrQJQq3rg7viedtdqfMgIyj8JARdQS3nleZatEu3_Mqkp9pITd48tT1_KzDVUpmDv0jYtiQTbF9BoCrE9-9idtXkrP8Qle12N9qMpVDidlp7gJyVOf5Sxdbqmysw2g5p23lBBqu2-5NzZn8rylvyk0VTgvnOrOhUrBWJKw41ybCeyYKznHiYRqvyxZlVkYWxcWiCiDEKgxQduKxPkcou5G9YCPxUEs=&p=10&fvj=1&vjs=3,NOT_FOUND
275,pj_0ed122a2e7b996ec,Boston,data+engineer,Siri - Senior Data Scientist (Machine Learning & Natural Language),Apple,NOT_FOUND,This role also involves technical leadership and mentorship of data scientists and machine learning engineers....,NOT_FOUND,https://www.indeed.com/pagead/clk?mo=r&ad=-6NYlbfkN0D4BtUbIrDMkalq6ptvGBorBWk-T6D_x1TipmER1OxNA9z07-yGEh2dSWRzX8wqAptVrDOq-s0mSesalBIvFypImfCctj9N_TvBdKeS3t9jw6AA-Hcvrchtelz0UTFWgSzLghv96iT6uDZYzir35gSL8kHdNJ2RoO0X2L44ajyXf3EusqxvHbRtOdiC_MbZ-BrPRyZUtUZPZg0nag-qvKyH5IhOaLbchFszQEFM-6qT2L7-8Zy2yGkLEoBM0sNdNVY4P0ggUchLibmfA-xngVtoyo5nFFbQT-rfAfE9WaDHg9Wtq41AmCYoMj9QYIduV5Yh7TxNA4opwgVn3zZZi7x3exSEbGsS4glj7c2u_iqglggQEkQzDmTabxy4Ngx0AF2sTgr8OGU20u5ZlAA7_FT05VxeXvl--I2g9XC9jg07EeGrzLS43YQDeftuKMrqXA1iPkS28-9pGUkJ61V8nBhuXAPhnM3Px9QtvB9XM2rXp7GYC0p5sAUixQi7h0NKMhuGP6FtXKCMRQJoQQiA2UnGZ2odSdXANO-jkkrI1qI3HXMRi2z7tnon_-bgzucwXUF8WqLdBaSa1Q1Nbb0uuOhsBOUsycuJGFXo4z_aU3BFuQ1A8AoO654qpjdqJr2aIbD53R3Aa9ZzVZKA9cElFAt6T8WvpWVilNQMkfHpakn_dQ==&p=11&fvj=0&vjs=3,NOT_FOUND
276,pj_7284f97476394efc,Boston,data+engineer,Senior Systems Engineer/Data Scientist,Cenergy International Services,NOT_FOUND,"At least 5 years of work experience with 2 years focused on Data Science/ Analysis (e.g., Data Mining and Processing, Building Analytic Systems driving business...",NOT_FOUND,https://www.indeed.com/pagead/clk?mo=r&ad=-6NYlbfkN0BbyS3g3l0OnpNvA1X8G22NJOCiqpCoEy0AiiwsVTMfNEChf2Nt7d0n385_i-_sP9-4j7BZ1p7Fv2Bx0nzpwgPsLbSq72mZ_gxwdBW3Jku5LMYiqn95yk8eKaXADs7e1NnksDpaVHTWVujPjW7-JgmZsIS7n0seEUsggFNocT3aWa_1v8v520fuBH8qbgwj2p2mAnZ-YtJRcKCyMwLedT6w4rMiXv67SlZEn28d52Jij31WSqRyf6B-TyDZYj5svuVqQdEdidZeonK-tIIC_9MWVf6tydpB4JzJE_V97nqoZ5Mhc2SsJF6O1mPPt22z8AdrnE8Sg-lUiK66u8jZn_lnOu8Eu1qhxuyr0kxT67_qbE-8aVX_Kq_Eysr-nJUwDy92ytCujZTGtbsAHDHBuxYC-mwqivTquHC4P5S8pTP5MwxXEi72uyvj6Sgyxmg8RZOVfZTS20yB-w==&p=12&fvj=1&vjs=3,NOT_FOUND
277,pj_4cf706310e6f3330,Boston,data+engineer,Product Marketing Engineer,"Sifos Technologies, Inc.",NOT_FOUND,Sifos is the industry leader in the test and qualification of equipment that utilizes the expanding Power-over-Ethernet standard for combining high speed data...,"
                $70,000 - $90,000 a year",https://www.indeed.com/pagead/clk?mo=r&ad=-6NYlbfkN0BH-Ox1QkPFMCkX4MhMorLi97ErmB4kRLTJPdbKUhezxp0F44gdSh8FwCKSUNNtJujXX56ezXPst39saFHqi2Kv8Gx_GShHfzg_NIkYDNJmVuKhGsYhIdJs0OX_rEVXKYi-3y1OcqfwXBfI_oPlJot1hzn29UmBT-QuJcXZ3acYgkZIuKWCh0xwwcpWsrca9Ubslg6QlBcWkdqQQEl_SiYcRTZxQBoN3xnYd010AEbAq1J4DXirOos4XiJcCi5iqWxSl40XbkhUFdnb5bxUcg4WKIhxAnQQYThmWKjwXqsUvewyoWG44VZ6Cmi2TqR-5I_eIW0qstoHlNjAHHZP-B8g-LRXPc9X_sCmQ4qXIoydjyeJ0NYFJqAAAl5sS5HY95CTiPeKurzUtoo26fJkXydfy5aOHmrA_PzwZKPRhtqWQzR27QP-zZ4gch0DFxZjUKU=&p=13&fvj=1&vjs=3,NOT_FOUND
278,pj_2a7e5cc36166b0e2,Boston,data+engineer,Jr. Transportation Engineer,"RL Controls, LLC",NOT_FOUND,"Ability to perform technical tasks and data analysis is a plus. Coursework in Transportation Engineering, Statistical Data Analysis, Technical Writing, and/or...",NOT_FOUND,https://www.indeed.com/pagead/clk?mo=r&ad=-6NYlbfkN0Aousd15sYXrhf4YXk14MwJxuY1ivfOO-TlskXG7y3ogYefHmoL1KdawZu9DmEK9MRPtXb1eBQXIy3v_jY-OxE8YlwYcWfvFeN8rEw5-du8GJscAaJbJvDDKqN_lHxN1_TUkEG2ESu7W89WMEkSJEgWDQKdudVeKkWGovJbCKPhha9PyUiK72mcqV4D8B8rReJ1M3wlTjk43uAdSwQQKBwhSAOsbUe811Y9knvYWWHOTby0DwQWy_LZLO8DL-AQCr44ZdVVe73y1J3pNx4CbwAxeU_jdNKazcyFRkwar3Abey_kUhqhlu71nuBgJo5QbkVMOzDdrD-SKgnytq4w0UGwdKrW9dzyMVnLVScu-Xc1Q0E5tUtqF56WudFbgl12W0b7vyIC5UE0Q4ibpz6aG3LLdHWQNCCvZbFEzrVMdxtg0PvwhSC655c_8yyAoEG9Nu0=&p=14&fvj=1&vjs=3,NOT_FOUND
279,pj_79cf28cf1a59a2c2,Boston,data+engineer,Data Architect,Wayfair,NOT_FOUND,"A data architect builds the foundation of Wayfair's data ecosystem, partnering across engineering and business to ensure the timeliness, cleanliness and...",NOT_FOUND,https://www.indeed.com/pagead/clk?mo=r&ad=-6NYlbfkN0BWKOYaUJfzlpbj8B4EVHsr8Rk3do3CBb7WzQD7M0cgO4MmQYBeubwD0nUaCahAaLhz3rqYe-iK6Wc0QxBMD-_Wu2HLMLhLJI-Y3rzxcZRSwY9fvZs1Y3uJcPW6XOcaYD75fKkB1XAJko0gIkOtwWw183aT2iX4-AvBDqYyGhCpuiG784nCbeLdEMWaSGBtxAjLB1nKuP4RcjE7_BHUGYR-bKqmi-Xilr8XgLhF3rg96qK268e7Zz17nqaizdMMHBox7Hes1yO_EqqsGA2B1U60tMOD0odPIzVeQE_otFB5TCQ4vDplUCY1jqFHhzKU42LfCKX4hd_gSabK5SKW0uZS1-NApsUrRr4xmEEApBqQysixLc4RIVsEbG9M0J2V0kY8m4UKTLxKuJCjH-sueUdtAS3ORVuTHFDtsz_uP9s57ZkSDALBdCzGI8bK0mc-9P3Rn9SaABdA1j1sPyLATy51V8XlEg2CdPDlzJA8YPijsMlRiVPVxuhrsyfCReY1QAFgGPV0MnIZzAFLanJy1fAwG86hMyDs6qrzxmb99dcpzq-JGv9i9vSKtXAyDauqgX8=&p=15&fvj=0&vjs=3,NOT_FOUND
280,pj_3df7033bbe451c67,Boston,data+engineer,SENIOR DATA ENGINEER,Benefits Science Technologies,NOT_FOUND,Improve data validation and data quality monitoring. Data security and encryption:. We are looking for a passionate Senior Data Engineer to join us in building...,"
                $120,000 - $150,000 a year",https://www.indeed.com/pagead/clk?mo=r&ad=-6NYlbfkN0Bo83FT8hN2PCWuwik2MfjabT6etR7Ty3Eig64gwmZDXFBwUJEQdWreFWKElPOydQh-Q_EzkiS6fcSmglBjKMPhzIwwN63qzrSaICM5nTLmslg7L7pncS_gEyhGyALI7S84-ugBTEmzcXrHyJVVgO1p35NMgRwdC6k0UbCJcCZjxYJnujBQZCi-CBsDkmvaf-C6ekCZWkShUQYR6SVs74qw62RAeDaxHOmvtIvKbBIietbjQgciSvWn0yYYVYzFOew_O-oaaZGTjfJQjM3oW79RXXU3V94CDIcrfJ0PeJZio-kx3nAbqEwjs2U9zlPkniEK9M4QdW6agx0vFuYbkCxUB_UFusmxhD9T0UKRK2wybA8XshiRqLQqpgxUcWTqAeHoDGH4d4iB6kcjb70REFO7LCpzw9vWiAisC5Alk-HYSDxiCcTO0UrE&p=16&fvj=1&vjs=3,NOT_FOUND
281,pj_c98d1ce3ee653cc4,Boston,data+engineer,Junior Helpdesk Support Engineer,"Bay State IT, Inc.",NOT_FOUND,Communicate with Helpdesk/Field Engineers. Some analytical ability is required in order to gather and interpret data in situations where the problems are...,"
                $38,000 - $44,000 a year",https://www.indeed.com/pagead/clk?mo=r&ad=-6NYlbfkN0Aq7V8qbMAPCPg74Ici3Ykfl8KCDQgSE3oM5G8LA-BPGL4P7_NeGmqL6h56dgQ3yNc-yB19iAVZTppDacNzSLfgmnOkXuTdxUZimUbUSIOtclpF8Q6JmzeexoW_JNxtMhavoVKqDuuK7mtrLlFitj7P9YKNK-U623XYInaWXb_EPZZ92zF6XwMlQOfH8bxDcTaC4rc6rsUVww_pMIoiwxpb-5UiNgFrF5unhfi79xL29kUduAIAb855aPakY-xG2E-1JSQOMhlIxujRL0Seuf8ltn3mAbTIliDoQGQcyVAIkzUdqg8GDbZCCIYUuvlWY0Hgh2uG-XzPqjZN55Y4P9EVY45r88XrruKZNxmBMeg3hERuflnmbMFaoF9d2U4T2jSLbr2ghAZmD-lGpHDvI6ureO8C41skV1A_g-WuTIlIaW1baGyIyTbpNi3Kbr8q_Mc=&p=17&fvj=1&vjs=3,NOT_FOUND
282,pj_c3bc11267ccede5a,Boston,data+engineer,Data Engineer,Sea Machines Robotics Inc.,NOT_FOUND,"Manage and perform data analysis to identify data quality issues. In-depth understanding of database design and structure principles, data management...",NOT_FOUND,https://www.indeed.com/pagead/clk?mo=r&ad=-6NYlbfkN0AHdFIJfBLGYbx_TzBCBsgbK0Due77H36xmGRpY2MfZsPwTPTh4aSQRFNCGEArHnMvviCNe5JnuWNMqtdZcBvIfU2yZuPy0QwO0-wkoQzNojCcEfroTLtF0vikT6bN9EMogcSG1Aq6SrRcAZCVGhDs0G49BJ6URjSqiL8RAOupmaN2zY5sATkh8dCln_Nb9zIhk1OlK1f_r3PiDANWQQdnzILtE9I391zAMhm_46itif1alPP26TgJlMXIv-wfPoEqdZlYLhT5-gvaD8Ts6FpUq0NVMSHdNfMvHLpKeB-DOiY3pLmX8SmQAuJ2310283YRSS-oxmdoJ6zU-cWTAcJQFYfnlSxjRIuTTKhH7tyYBbSFP0VP_TRnGgCcoseaGE96S4rn0bdSx0m2Sl0-f-kxo5y8iKXY9Z62gkeAzvCdtlw==&p=18&fvj=1&vjs=3,NOT_FOUND
283,pj_c3bc11267ccede5a,Boston,data+engineer,Data Engineer,Sea Machines Robotics Inc.,NOT_FOUND,"Manage and perform data analysis to identify data quality issues. In-depth understanding of database design and structure principles, data management...",NOT_FOUND,https://www.indeed.com/pagead/clk?mo=r&ad=-6NYlbfkN0AHdFIJfBLGYbx_TzBCBsgbK0Due77H36xmGRpY2MfZsPwTPTh4aSQRFNCGEArHnMvviCNe5JnuWNMqtdZcBvIfU2yZuPy0QwO0-wkoQzNojCcEfroTLtF0vikT6bN9EMogcSG1Aq6SrRcAZCVGhDs0G49BJ6URjSq1yUOdSAVOdzMhQCuNhIYkpPcbpHYfBr6rTN87UWNeANyLdzjSp8e2DnfFGThqlwwL1_IMMI-Jjjo_ZvYcJeHHu9lj3rnS6I6M2dZd0cbhlO8DFXCxqlxlJdHw8vKLX3h0w8mBjWBxLQwMosr0RHmrSsBhoW8aenoqMwBs7gSwxHj9exGmQzt9jmK_aTt1av0ydF_w9LJBpvXXzMLXhPcWG8jat-lNhMDzZoRvwaiqhFXW_omuuwjk5hXZFe9DMhV4XueLk3ouJA==&p=0&fvj=1&vjs=3,NOT_FOUND
284,p_0ae8a36e872d1426,Boston,data+engineer,Junior Operations Engineer,Workable,"Boston, MA","Develop software to automate the operational needs of our customers, such as integrating their hiring data with third-party providers....",NOT_FOUND,https://www.indeed.com/rc/clk?jk=0ae8a36e872d1426&fccid=ce6e7bbdb5754d04&vjs=3,6 months ago
285,p_5e0831c99bced000,Boston,data+engineer,GIS Analyst,Commonwealth of Massachusetts,"Boston, MA 02108 (Back Bay-Beacon Hill area)","Knowledge of spatial data, data standards, and metadata. Significant knowledge of geographic analysis and manipulation of spatial data....","
                $57,441 - $83,762 a year",https://www.indeed.com/rc/clk?jk=5e0831c99bced000&fccid=4dd38d4e4cf0b7c0&vjs=3,30+ days ago
286,p_14dae53958e6f093,Boston,data+engineer,Frontend Engineer,Edmit,"Boston, MA","This is the best frontend engineer job in Boston for mission-driven engineers:. As Frontend Engineer, your primary responsibilities will include:....","
                $100,000 - $115,000 a year",https://www.indeed.com/rc/clk?jk=14dae53958e6f093&fccid=6df67a2355de7f10&vjs=3,5 months ago
287,p_46c758628e519882,Boston,data+engineer,Junior Mechanical Engineer (Fluent Chinese),Skyray Instrument Inc,"Boston, MA",Gathers and correlates basic data and performs routine engineering research and development assignments involving calculations and relatively simple tests in...,NOT_FOUND,https://www.indeed.com/company/Skyray-Instrument/jobs/Junior-Mechanical-Engineer-46c758628e519882?fccid=7ca6b9bf2402f3de&vjs=3,9 days ago
288,p_8946e534e0d37b43,Boston,data+engineer,Database Solutions Engineer,Pluris Marketing,"Boston, MA","We are currently seeking a Database Solutions Engineer preferably with an interest in system design, integration and development....",NOT_FOUND,https://www.indeed.com/rc/clk?jk=8946e534e0d37b43&fccid=dddf10f6e5ada30c&vjs=3,4 days ago
289,p_e134bb411fa77bf1,Boston,data+engineer,Data Scientist,The Boston Consulting Group,"Boston, MA 02109 (Central area)","This role will work closely with machine learning experts, data analysists, and data engineers to create appropriate data sets, engineer features, train models,...","
                $112,000 - $165,000 a year (Indeed est.)",https://www.indeed.com/rc/clk?jk=e134bb411fa77bf1&fccid=b95f9eb47968fa13&vjs=3,30+ days ago
290,p_ca9e7c2bc3d2ec0d,Boston,data+engineer,Assistant Area Engineer,Commonwealth of Massachusetts,"Boston, MA",Gathering Data by District associated with request for data information. Coordinate with Area Engineers to:. The responsibilities of the Assistant Area Engineer...,"
                $70,218 - $98,311 a year",https://www.indeed.com/rc/clk?jk=ca9e7c2bc3d2ec0d&fccid=4dd38d4e4cf0b7c0&vjs=3,30 days ago
291,p_95ae5f5aa855d835,Boston,data+engineer,"Software Engineer, Data Storage",Fitbit,"Boston, MA 02210 (South Boston area)","Core data storage infrastructure including sharding system, id generation, time series service, data migration frameworks....","
                $94,000 - $141,000 a year (Indeed est.)",https://www.indeed.com/rc/clk?jk=95ae5f5aa855d835&fccid=477cda8eacc52791&vjs=3,5 months ago
292,p_3dd89d2f36098417,Boston,data+engineer,Support Engineer,"Amazon.com Services, Inc.","Boston, MA",Alexa Skills Kit is seeking a Support Engineer to join our international data team to help us improve our systems and services....,NOT_FOUND,https://www.indeed.com/rc/clk?jk=3dd89d2f36098417&fccid=fe2d21eef233e94a&vjs=3,5 months ago
293,p_46e0a4d492e15066,Boston,data+engineer,Big Data Engineer,RGBSI,"Boston, MA",Big Data Engineer / Architect*. Experience with data ingestion from a myriad of data sources:. Perform data movement/development leveraging Apache Spark up to...,NOT_FOUND,https://www.indeed.com/company/RGBSI/jobs/Big-Data-Engineer-46e0a4d492e15066?fccid=ecfea27496c25ff0&vjs=3,18 days ago
294,pj_4cf706310e6f3330,Boston,data+engineer,Product Marketing Engineer,"Sifos Technologies, Inc.",NOT_FOUND,Sifos is the industry leader in the test and qualification of equipment that utilizes the expanding Power-over-Ethernet standard for combining high speed data...,"
                $70,000 - $90,000 a year",https://www.indeed.com/pagead/clk?mo=r&ad=-6NYlbfkN0BH-Ox1QkPFMCkX4MhMorLi97ErmB4kRLTJPdbKUhezxp0F44gdSh8FwCKSUNNtJujXX56ezXPst39saFHqi2Kv8Gx_GShHfzg_NIkYDNJmVuKhGsYhIdJs0OX_rEVXKYi-3y1OcqfwXBfI_oPlJot1hzn29UmBT-Snczh4SLUOp3Pfz3kcVYY8pZUii15WmCnUQzrgxPIz0fLB-5dsWPDHX1F9oKU5K0VS8GoB8arWU2vypg52BhrN9rMlVxcF9P6JMMRT4QEdwGn2AQlAd0idw2S_s2qodBpQvCMg0V3LOL-tij2xspak1H4sBVKcyfzpCx47t6v97brjHEsFDEp42O4TxSiN_F3J_378GRnP6WBSk3QZ9PnWoW8HuojZLXrfFdYCmJcNLiflWUuxkOZ0dDUV5ZbLTd0_hP0X1IFB6AT_dL80mGVfAPfQHZ4sBzY=&p=11&fvj=1&vjs=3,NOT_FOUND
295,pj_0ed122a2e7b996ec,Boston,data+engineer,Siri - Senior Data Scientist (Machine Learning & Natural Language),Apple,NOT_FOUND,This role also involves technical leadership and mentorship of data scientists and machine learning engineers....,NOT_FOUND,https://www.indeed.com/pagead/clk?mo=r&ad=-6NYlbfkN0D4BtUbIrDMkalq6ptvGBorBWk-T6D_x1TipmER1OxNA9z07-yGEh2dSWRzX8wqAptVrDOq-s0mSesalBIvFypImfCctj9N_TvBdKeS3t9jw6AA-Hcvrchtelz0UTFWgSzLghv96iT6uCff7MtvFaqXbn69P19iQGN0v2a61LGeUSqGwvzaCdMr9WCR7NUk59WC_1Wd5aKi8jXjmvI6T6rf36Lkry8Y6s0Wf_9VLkZGBeO3VJy_-S6xI7gaVDMEqLxN4V9fg9y9Fs_cEGvsaqVZ8zT0Vjh6U_dkcWGLNnDzz4vAxI2_2RXPgNzHfF1F1hJCQvp1nM6EX6ppBJBiUneyk6htiFDptsJ7FkxfxTVue3jGdPTwocXsnOik-FniOUdrwduvpDLYoqpMf6SpfsG1GSKaIAnDZQuJrUC_dnbdgtoxzSVW__CtGL44f8B9B-On_xVt6jX_BeKnYo0_Umz5Ezur1yMiELHUkj4CjAPE8-Aw_MqsuFp59hfHDdPp68ssxrOFBSSZ5UfeNSIg-mtxzfYr5phqp72Tny9s0S-JdT_sDSDhrx22qKQOiYyIeJuTTBIPDu80cvpZFNdvVKGa5y8uqOG7X4bL3DspuGcpYs0lOAj6FECB3Q07Uu9iKM1UdcNVZI0NAgEGvjvHWNG-3p36IH5112BCfWVovzbAOA==&p=12&fvj=0&vjs=3,NOT_FOUND
296,pj_79cf28cf1a59a2c2,Boston,data+engineer,Data Architect,Wayfair,NOT_FOUND,"A data architect builds the foundation of Wayfair's data ecosystem, partnering across engineering and business to ensure the timeliness, cleanliness and...",NOT_FOUND,https://www.indeed.com/pagead/clk?mo=r&ad=-6NYlbfkN0BWKOYaUJfzlpbj8B4EVHsr8Rk3do3CBb7WzQD7M0cgO4MmQYBeubwD0nUaCahAaLhz3rqYe-iK6Wc0QxBMD-_Wu2HLMLhLJI-Y3rzxcZRSwY9fvZs1Y3uJcPW6XOcaYD75fKkB1XAJko0gIkOtwWw19c4SC2Ca3Q8RYWzD1AsgaEojdAJgntQ2D7xpC2vuPH112RSnUnIJgTFd75LXW_2AfQEj8Sltsg_K9YF8zL74pmHwCsWWJeVLbk7EroH13GUizEXKK-ElM58prMegHZcIqUedryHEmsksLelSExPKxb3jApuzB_7cAp-eB9X2YWr2cjaB1u5RwLtSOZs4PoUWM9J49DtRee4FhY6lrgK7jyB7iKFw0gNOfQPsTs_RAOwrfrduWNt7yNi-rQCkZowYtEIlNX0xCcHQgVOczMmpiGHurNjlg_ISe-RzLAfgrS4T9oN_-a2Apf4cDkaXan823uB7vaXx0_jQ3X4p6WzMAbPic4bH3H_9UcBQNkJzTXXhmAPUEu2IRT_vY--Gkhstu15O2wtgzud4sQ_ahuRjaDmnE8Xyo4lNIpmL3UGms8U=&p=13&fvj=0&vjs=3,NOT_FOUND
297,pj_c98d1ce3ee653cc4,Boston,data+engineer,Junior Helpdesk Support Engineer,"Bay State IT, Inc.",NOT_FOUND,Communicate with Helpdesk/Field Engineers. Some analytical ability is required in order to gather and interpret data in situations where the problems are...,"
                $38,000 - $44,000 a year",https://www.indeed.com/pagead/clk?mo=r&ad=-6NYlbfkN0Aq7V8qbMAPCPg74Ici3Ykfl8KCDQgSE3oM5G8LA-BPGL4P7_NeGmqL6h56dgQ3yNc-yB19iAVZTppDacNzSLfgmnOkXuTdxUZimUbUSIOtclpF8Q6JmzeexoW_JNxtMhavoVKqDuuK7mtrLlFitj7P9YKNK-U623XQrQrZf5dXT341vhATH-XV5Y7fgg9jqwvxu2kyqP0q1CT6thlRoCnMMWZLL4h94NJOmYwtdR9s1Nq-WghjgRRm208C9iLb4DuGo4CRni1miPQjnreVh0I8dKhat4NXrxo-1dw3mXZq_7IvxAuk7Gt7iae-Dy5UGesYJZWOGiDzDz6e_g9P8JA1Vfhnon6HsTvVJaduRP5wLwI-FHYRuv8Jfy7NfvcO_yQrkpR09i_I0inJo6WFYSmCZilFK7PSRhnX7YCFf6ae7Lpti_vs-PItXBYfzrmQOI0=&p=14&fvj=1&vjs=3,NOT_FOUND
298,pj_7284f97476394efc,Boston,data+engineer,Senior Systems Engineer/Data Scientist,Cenergy International Services,NOT_FOUND,"At least 5 years of work experience with 2 years focused on Data Science/ Analysis (e.g., Data Mining and Processing, Building Analytic Systems driving business...",NOT_FOUND,https://www.indeed.com/pagead/clk?mo=r&ad=-6NYlbfkN0BbyS3g3l0OnpNvA1X8G22NJOCiqpCoEy0AiiwsVTMfNEChf2Nt7d0n385_i-_sP9-4j7BZ1p7Fv2Bx0nzpwgPsLbSq72mZ_gxwdBW3Jku5LMYiqn95yk8eKaXADs7e1NnksDpaVHTWVujPjW7-JgmZsIS7n0seEUsbcOs9iqnOvVMenfiFD2fWsfKg5ixG-lxlML3oMM-JKex01KHHZk8g6Ium8S5BMY7sImnoUaQgnULoOlCV_mqaZN13uoiWY2li4ZWjfk1gbsQLj9Z2am664ksK7zlclbV_qg4VXMTM0LZskhzyu_e_sjM-dO2fIIHSzFzp1lmgXEAbZ2LeXt8ciRgVrf2dA3y1iqiiMCNnvbEL72Vvdv7Y20OIbzz917PKN8BieXlvE86yyebqjUQNCPg220d21QR-3NXkirbedrAWAOpk4ifd-VyJrWvi-d4X0kEgrlw_vw==&p=15&fvj=1&vjs=3,NOT_FOUND
299,pj_2a7e5cc36166b0e2,Boston,data+engineer,Jr. Transportation Engineer,"RL Controls, LLC",NOT_FOUND,"Ability to perform technical tasks and data analysis is a plus. Coursework in Transportation Engineering, Statistical Data Analysis, Technical Writing, and/or...",NOT_FOUND,https://www.indeed.com/pagead/clk?mo=r&ad=-6NYlbfkN0Aousd15sYXrhf4YXk14MwJxuY1ivfOO-TlskXG7y3ogYefHmoL1KdawZu9DmEK9MRPtXb1eBQXIy3v_jY-OxE8YlwYcWfvFeN8rEw5-du8GJscAaJbJvDDKqN_lHxN1_TUkEG2ESu7W89WMEkSJEgWDQKdudVeKkVchn-GJmaURReiFIv4FP9qqIwtrGvrdgEYSrybHMZP2zIJ92ZlKPU7tzhZadyep9Ktk4aCH-m6YM-fe3o_F-mUliHCQLXHaM11avhjj9uulE7PxcLPUMa71Y7aVkzj_DuY9R52UTfHJuTo0oZj9Eh9YiaYSseYSRx28FS1_nPFGEB77CLKi_EK796poJ9l8y0ynU158pAjOp46Mgci8vEiYD52KgDfF2u2XdjRo1zC1SyB18-BnBdPJBvoTN0ZOzuk9zj1weYawpUqmlC2C850T5CqMLBLuwE=&p=16&fvj=1&vjs=3,NOT_FOUND
300,pj_3df7033bbe451c67,Boston,data+engineer,SENIOR DATA ENGINEER,Benefits Science Technologies,NOT_FOUND,Improve data validation and data quality monitoring. Data security and encryption:. We are looking for a passionate Senior Data Engineer to join us in building...,"
                $120,000 - $150,000 a year",https://www.indeed.com/pagead/clk?mo=r&ad=-6NYlbfkN0Bo83FT8hN2PCWuwik2MfjabT6etR7Ty3Eig64gwmZDXFBwUJEQdWreFWKElPOydQh-Q_EzkiS6fcSmglBjKMPhzIwwN63qzrSaICM5nTLmslg7L7pncS_gEyhGyALI7S84-ugBTEmzcXrHyJVVgO1p35NMgRwdC6l2Hs3MgwcDGqmnfEal0MdzTiqNNnm0Pc_rt2_VqYp7R7h2xkVHAW_exaWy9z5k1DHSVQqMHr330vRGBL9Mfroz5qxue7xo6UpKvpHUSHxrenwF6H-aeCHGqmg09_VQVWO41d23jKXIpI4rxx9S_tmlXnMFmab3s8Qy3FRpuW6GA-zrDBdvweYdfCmNpEvOSU1LKuYqDCT84DA1bGcYBonUvJFHq1gWIeQ-XW1PBP8N2fUduDpPLJJ8U9SLJzLpDo4mgtWszIOa9GmH16xDOPC8&p=17&fvj=1&vjs=3,NOT_FOUND
301,pj_2a7e5cc36166b0e2,Boston,data+engineer,Jr. Transportation Engineer,"RL Controls, LLC",NOT_FOUND,"Ability to perform technical tasks and data analysis is a plus. Coursework in Transportation Engineering, Statistical Data Analysis, Technical Writing, and/or...",NOT_FOUND,https://www.indeed.com/pagead/clk?mo=r&ad=-6NYlbfkN0Aousd15sYXrhf4YXk14MwJxuY1ivfOO-TlskXG7y3ogYefHmoL1KdawZu9DmEK9MRPtXb1eBQXIy3v_jY-OxE8YlwYcWfvFeN8rEw5-du8GJscAaJbJvDDKqN_lHxN1_TUkEG2ESu7W89WMEkSJEgWDQKdudVeKkWXu2uX_k7qKzqU3ug6fNkL_zg8qnvI-O6fsDyhr4fTtLtEL3pbQY0vNLW-6I3TqzePwf0otlJ2-fccxkjUekgUkeiWh2TV9AYaadfK1SDm7VNaX9zKhTaVEMiubSYnW6DYx4j46rbdLSiPXv4V7f2E24ZjQuI1XBORRJuXbSJt_R5JOhOFhymUVLPFqc3HXg7kgKaHVbVdH0FEenFSX5E9eSUg8WComQAVaqTHF8o2lYG76lrDjFrRLKx5bQpcVBL9muj7YbVDgan25OX6wFALvQ-Xqw-xhdk=&p=0&fvj=1&vjs=3,NOT_FOUND
302,p_3eb7545c3168dbbc,Boston,data+engineer,Sr. Data Quality Engineer,Bose,"Boston, MA",Senior Data Quality Engineer. Data Quality Engineer employment opportunity in our Central Data Organization....,NOT_FOUND,https://www.indeed.com/rc/clk?jk=3eb7545c3168dbbc&fccid=42f1e4ca72488e15&vjs=3,5 months ago
