,unique_id,city,job_qry,job_title,company_name,location,summary,salary,link,date
263,pj_edc59b9d2e20c932,Chicago,business+analyst,Business Reporting Analyst - Healthcare,Dupage Medical Group,NOT_FOUND,"Ability to understand end business need, research complex data models and create reports from scratch to direct business and operational decisions....",NOT_FOUND,https://www.indeed.com/pagead/clk?mo=r&ad=-6NYlbfkN0Ck9tLHwkWfEoxUitczklUtEb3JHaOoZd3oUK2oGwTq_zZqm3ieYVUw9ClbKyUjdtm3MhOabnW1P8cUfdzSNpCiB2Vbaypk3CUVMb0cK0zGaHd9MrGG2-p70CWXgIUycrKsMeAcAdTqlkXLXSsaQjy68O6SpSHcr4moopNjfT8U2b0xJ8QuH1PePMimv3cE5jLMcgwUO9o4XEq6rfrjIOW_kXJhuxMU--YjGRLP_vrOv6NZL-oWO1WNLGTaplplY3HNI7CYthuLSncGFOpZv1LwdHwf63xXYemF8mMxfdYdbxepeFu3F5Z8Ux4_ovKO_daUuSTL8TvJoVk1o0Q8gtJfbEnlXFMW_M43qKdgb1Vw9gsGNqfjdbCQ6qiiYa4p0ucNT0S__6eQiKDWPTOV6BY8ezdnWCkZsYgjBW7HpxjM8ipjp-5xd9OIDVE_evFAFfPSWVAnbWaUsx5kmUOIV87t-HwUv_74chA90Y0dZZyq3s54ltdBYiNUCYMQhxg0tb4FfPt_RDeg7y3Rybu8JkNMEX2sBLF7kYNCNAf-n0r0VlJLAr4ryUxTFEgySx82wuSJr7U82y5pvA==&p=12&fvj=0&vjs=3,NOT_FOUND
264,pj_fc1266929a4a953f,Chicago,business+analyst,Business Analyst,"Yoh, A Day & Zimmermann Company",NOT_FOUND,"4-6 years’ experience as a Business Analyst. Business Analyst needed for a contract opportunity with Yoh’s client located in Chicago, IL!...",NOT_FOUND,https://www.indeed.com/pagead/clk?mo=r&ad=-6NYlbfkN0DK_2vZ9EgcAccGC6GsNncjWNqkq9sVUS_FbvEJI1Nrv_ofcc5MGKLsZzLrqwWzH_nBPqANe4uXrczbFuc3WI9KwDqzelBqdUif0F_QwDFCzZLSv-rZXI5U6VNXNhhUhAazgFGS6BFrYtqt09LUUlAdbs_rFvZ0auJYObx0qcFVYwd6SZjU3e-ug8NJG-gpZgEfknLszEO1r7gXVDzJFMBbKZejfhxLUgw38J96uVj4RxFB6PsTbW0hWAmFczHkV-nIvj3cvxlV2s9zc_Qyxfo4jUHqPqyT83jLBV6qkGExMAufz4q26oGOJ6cy0iSV6UZYeGDgj2lOvFL1BI-3ZOfTXrUVG-N8QIAAE_6rfP3qzm7J9B6Oe6S5ovsymGID3PwPphk3KpDCf0yfYTwFv6mjm-GhI-4ULFuPORLGNlVmu7_fVohk6di5&p=13&fvj=0&vjs=3,NOT_FOUND
265,pj_019afd79d8f66d59,Chicago,business+analyst,Applications & Business Analyst,"Justrite Manufacturing Company LLC, a parent company of Basic Concepts Inc. and US Chemical Storage",NOT_FOUND,Provide support to project teams with focus on business process development and strategic business direction while maintaining normal operations....,NOT_FOUND,https://www.indeed.com/pagead/clk?mo=r&ad=-6NYlbfkN0AWid2H6RPrKGcO0cqz4-fUlgP-QLUJ9RNEoqPG1FOoz2juXhaCiccTfrj1SHbTfh41tXahTicVvxzoqpd3sm4XgACGn7Y3HDmv129KuGcbnozxKvHg037GI5pF0gbeK8Vgcv5hLGF00ctmomVscpa8NVZZPSkciEm4beO--FcrS_uvyNKc2uqIqDAVLUqQkXDxihZBbkdwLzZReSeTI1oXDPwVWyufYjpgr-UpuVtC2A3yq0kOAzx8rZwPR3sDrZuyXc_0qaa6H-a1EGJwwl1wxy5ihlYjrgBT3D_mCuJT0sPC6BQgX0hkfQ7e36D1Gzsd-3qgS8a0TEKWm6_XMWcLwHRIrAjdLTdgoGBl47Rxc-u9Hy_jFyN9kEE6SAkoXJiC3BRcKCd1l3YI8du0u5U9hsPuvezn-F92Zk4b8RU9fXED4-lXnJKijZFvLjj1YHFuk3eJb3viWThaLDDn_B0MNot-uNCENlyg3FIEc2ZLT6CJ4dqPAVjm&p=14&fvj=0&vjs=3,NOT_FOUND
266,pj_47f7830367a86c07,Chicago,business+analyst,Business Analyst,PCMI Corporation,NOT_FOUND,The Business Analyst is responsible for reviewing assigned business processes from end-to-end. 2-4 years prior experience in a Business Analyst role....,NOT_FOUND,https://www.indeed.com/pagead/clk?mo=r&ad=-6NYlbfkN0B3ZTyI1Hljm6wvKfsBMMtNR89vRE52MyuUldfnLWwAaXEKLi3flA6ejbAYWyeMH3Tw0lAsz0q9jmuzUMv_S4-KALI9ryNDYG1gp0TZXwnoq2fqr1boQesPQ3oNKkBZuA7SQSkMIn29tiUGWfzFLFhHTw_b2yUFqYoaZbswKB6WCrFHbpKJLZ71uqzFHGEAB716JOL3pPm0P-8BQAR47B2Je6JaggrngoXxMwyWahoLpyHLtcrjajqTHISuIgoU1fhstircKYaNKAqNc0H_th2qc2GCe4xfwWzR4wDiQmYA_epgkMpRIFE97MsmQV7zjuIpI0nlV-L87E9nVsEk9TSdS7j0Yu-QD-ivVFcxR45lfiPgEl_tmd7h9K1vrWld3wJK-WksouorQqWzhTxSDU5J0ZBsyAtzXkErV1t6-aSDTA==&p=15&fvj=1&vjs=3,NOT_FOUND
267,pj_8d9b1a81da978f73,Chicago,business+analyst,Business Analyst,Randa Accessories,NOT_FOUND,Define business process and technical requirements based on business needs. Bachelor's Degree in Business Management or equivalent experience....,NOT_FOUND,https://www.indeed.com/pagead/clk?mo=r&ad=-6NYlbfkN0CB62aE2MGzXFnW1Pk6wtobCKe0AzfbionFUwocSa0hSxv5NbgndFRQvsfA2be5ux1DWigRSiVWfaU8elfHm_z24dW5_tFk-r5x4K9oYUUzRshYBSbL5_PSI6ZANheMqjsN5tQIhZWtfjbarbTlBZAYYTD3CdPOkApUL7O__3Eb74FgMB6AYFc_dSWHpA65uGBAPsnqf-yJUTge7Ai5iIVMknzukWQHBs2pY21PqManYazJUUhC0Gk9UihDyzMcqujpCit60KNlCjijaQgzyK9N2yW-z-PcYGHbzlYlb2Mqq-0bIOuTseoWQLxEWnzRb90-BPZY7mKEG2qXnqAn14XmrY6azBtPh_orLnx10nuGZrVj8yrMWu3l-ZxBKnIMsSF2FSWCYolyF4Se3pmuzlFSC4RDLJPS7VWUUO9jaDvBmaFn0va2P5uDUlKuOipFbNt4kyVs_NCq1kyqFWScUSfDA3lu-ez2jnn9fTeNX-YH3kvHgHuXHT5a3rfibMVNamU=&p=16&fvj=0&vjs=3,NOT_FOUND
268,pj_eba1a24b2410877b,Chicago,business+analyst,Analyst – Strategy and Business Development – Tech Startup,Enterprise Peak,NOT_FOUND,"Analyst – Strategy and Business Development – Responsibilities:. Of professional experience in business development, technology or strategy....",NOT_FOUND,https://www.indeed.com/pagead/clk?mo=r&ad=-6NYlbfkN0B0vl1Grz6052MlZg4RHGvuu6cYfkm88-BD1wPi7_xD2Y3GkfwG5etXuY4auJSbrl_2pEnSFDWzPK3-n4vU6A87BTmAt87zgfpDLyWfgvZKM7tzB-zN938bS5DnhAcalAVROVoVpwOQ57YaLhXRS_rIYmvrmitZtxOmSPddbSaHZ4KYaR2ScUDHUqXRynpbF7nAjuuIXbaDkL4caeYmmA4OCuAdhgnlZNbbzEsaIs9DdWTd8tw1gPet5i-PCcGgZN3J6cXmcyoWYAbG9u--yGDBeEykwwgkT89ZE1tYWyc0UuSwyIOMznrF82nsncSsQnRCVO1RbZmPnBqpL1zMkL8Ut_Pl_GFR644ZC_1BrwQ30w0QBonFKgd4dyqcD1Eck8WNvU5ujygdbJ7WqvzOLTNSsD4ac__nSeWscJrG4EKzQgBJNNq3d_aV3e8kNZMu7QrVXz0y91rIxf6RXB1LFU_GTu2jXBkYE5o=&p=17&fvj=1&vjs=3,NOT_FOUND
269,pj_eba1a24b2410877b,Chicago,business+analyst,Analyst – Strategy and Business Development – Tech Startup,Enterprise Peak,NOT_FOUND,"Analyst – Strategy and Business Development – Responsibilities:. Of professional experience in business development, technology or strategy....",NOT_FOUND,https://www.indeed.com/pagead/clk?mo=r&ad=-6NYlbfkN0B0vl1Grz6052MlZg4RHGvuu6cYfkm88-BD1wPi7_xD2Y3GkfwG5etXuY4auJSbrl_2pEnSFDWzPK3-n4vU6A87BTmAt87zgfpDLyWfgvZKM7tzB-zN938bS5DnhAcalAVROVoVpwOQ57YaLhXRS_rICf-hV4BLjMS-vBKN2mPQpmeT6tSqglbb5H7f-YAWNoBowU9jOu3pgy5JvUfGutJpBgEhYlY-kMYEh6-6HccJ9sbljCH0ZL3bpobyXU45jhEfnJgmS9RVsx1hgWB9GBtv9CCU7IXTum8wdFDdFA4T_409OVPp476UuxB7cp0KIfl7robbiLySLPzoIXvRApklo8R03-Oe_Gmfg6kjJlw76A_y7gAlHWtE_b4J7Ssh73jemeFkJnpkziELzPM5Cj2AdlaQ4MF9ngVGU-TH_X1NKKIGv06pgMHj6RUewYHpmkiFz2pwh6C21pP9GsGpKzssO_g0wHnqfg4=&p=0&fvj=1&vjs=3,NOT_FOUND
270,p_a0a53d93ae5adb72,Chicago,business+analyst,"Functional Analyst, Business Analyst",ErisX,"Chicago, IL","Experience as a Business Analyst leveraging formal Business Analysis methods (particularly Use Cases) to elicit, analyze, communicate and validate requirements....",NOT_FOUND,https://www.indeed.com/rc/clk?jk=a0a53d93ae5adb72&fccid=8b95e230f62ad58a&vjs=3,30+ days ago
271,p_4a7060fa20e08b90,Chicago,business+analyst,CHICAGO Campus Recruiting 2017 - BTS MICROSOFT - Business Analyst,Capgemini,"Chicago, IL","As a Business Analyst 1 you should have baseline skills in Business Analysis, Business Knowledge and package configuration....",NOT_FOUND,https://www.indeed.com/rc/clk?jk=4a7060fa20e08b90&fccid=105ecfd0283f415f&vjs=3,7 months ago
272,p_23b1ee08c1124af9,Chicago,business+analyst,Business Development Analyst,Hartford Steam Boiler,"Lisle, IL",Primarily focused on maximizing revenue and NUG growth from new and existing business opportunities to ensure solid planning and execution of objectives by the...,NOT_FOUND,https://www.indeed.com/rc/clk?jk=23b1ee08c1124af9&fccid=2798dcabd5229b6c&vjs=3,30+ days ago
273,p_8d9b1a81da978f73,Chicago,business+analyst,Business Analyst,Randa Accessories,"Rosemont, IL 60018",Define business process and technical requirements based on business needs. Bachelor's Degree in Business Management or equivalent experience....,NOT_FOUND,https://www.indeed.com/rc/clk?jk=8d9b1a81da978f73&fccid=788d414d8df7ab41&vjs=3,30+ days ago
274,p_783636ccea02edc1,Chicago,business+analyst,Business Systems Analyst,Chicago Teachers Pension Fund,"Chicago, IL 60601 (Loop area)",Gaining in-depth business knowledge to successfully represent the business community in arriving at technical solutions that support business strategies....,"
                $66,000 - $98,000 a year (Indeed est.)",https://www.indeed.com/rc/clk?jk=783636ccea02edc1&fccid=381bf2a0c93867bb&vjs=3,30+ days ago
275,p_712493cae0329a88,Chicago,business+analyst,Business Analyst (Health Plan Implementations),Evolent Health,"Chicago, IL",Certified Business Analyst is strongly preferred; Equivalent demonstrated business analysis experience. We are looking for bright and energetic individuals to...,NOT_FOUND,https://www.indeed.com/rc/clk?jk=712493cae0329a88&fccid=3586973f5b1c82b8&vjs=3,30+ days ago
276,p_be3fe2826c0edf16,Chicago,business+analyst,Business Analyst (Integrations),Echo Global Logistics,"Chicago, IL 60654 (Loop area)",Takes on the Business Analyst role to work with an Agile development team to lead them to building the right solution;...,NOT_FOUND,https://www.indeed.com/rc/clk?jk=be3fe2826c0edf16&fccid=7487844f51e3b3f6&vjs=3,30+ days ago
277,p_2cb566486b696f6a,Chicago,business+analyst,National Federal Tax - Business Analyst,Deloitte,"Chicago, IL 60606 (Loop area)","As a Business Analyst, you’ll be tasked with creating documentation including requirements, user stories, acceptance criteria, feature description PowerPoint...",NOT_FOUND,https://www.indeed.com/rc/clk?jk=2cb566486b696f6a&fccid=9e215d88a6b33622&vjs=3,5 days ago
278,p_9745e0cfec748ce4,Chicago,business+analyst,Business Analyst- SAP CRM,Dyson,"Chicago, IL 60654 (Loop area)","Reporting to the Business Analyst Lead, you will be responsible for:. Producing business models and assisting in the development of business cases....",NOT_FOUND,https://www.indeed.com/rc/clk?jk=9745e0cfec748ce4&fccid=366382f52796fce2&vjs=3,30+ days ago
279,p_5ed202b22d3618e4,Chicago,business+analyst,Business Systems Analyst 2,Capgemini,"Chicago, IL","Business Analysts structure, analyze and visualize an enterprise’s current state. Possible positions could include being a Business Process Consultant...","
                $85,000 - $127,000 a year (Indeed est.)",https://www.indeed.com/rc/clk?jk=5ed202b22d3618e4&fccid=105ecfd0283f415f&vjs=3,17 days ago
280,pj_e7519628bcc97a07,Chicago,business+analyst,Business Analyst - Telecom,Pegasus Knowledge Solutions,NOT_FOUND,"Serves as primary contact between technology and business end-users in understanding the specific business requirements, criticality and prioritization of...",NOT_FOUND,https://www.indeed.com/pagead/clk?mo=r&ad=-6NYlbfkN0BlDjqqQdl65rZW6VJDshyxVflWgdT-HEBt3zXmHRd9iP6TMe9uGjeF8-mPk9cdATc1-cHkXBbHxI5GDSb0ivG6QJdPmBJdEcVXFOPTNtxIUNjgvxIp6QRjhTMLvcPNMqPO_nwFibirm7ebD8YQXgw3pcDa2nRLW0qRgRYSUsW45MzM6ykDXz5dW6s8KK51nyBF9ecXDs8aYfjGm_nne6EKawPr9raoqNoLioBOlnCD9lxSlesoEJMuyYxNW5D4MHh5exAzZU-jj2G9x7og8N1aehxK62LKwnrxqN8LKlS3OTQlecLVqcVJng64itlLu_e2eKOhFMm26Hkgt9BFho6T-YDvMDG7Q-E-FSYgAlbm3izm2aMc5oABX-VSk_v07UzJmwEc4kZe1Q1za1FpmFCXRJWReywSWc7e4XCdlB_Wgs-UcroPpZbn5NULRS6leTlNdf_-hj-hRXo4_DjPlBROZCYF5qpiVbpvcSrmnLkrrxneglmmr-7uZUiHB-sMN3EB8YlvyQpnVlUmvZYl0Sd_&p=11&fvj=0&vjs=3,NOT_FOUND
281,pj_0fc7be7dd0affedd,Chicago,business+analyst,Digital Business Analyst,Avanade,NOT_FOUND,Strong business acumen. 2+ years business analysis experience in IT; Business analysis includes collecting and interpreting client requirements or problems...,NOT_FOUND,https://www.indeed.com/pagead/clk?mo=r&ad=-6NYlbfkN0CDyWCk2bf-hB079XA31Tw5ngkjovj5vvTWFlkYAEWq5DYCSpmq5uTl7s0-z08U1cvjtPw73MWhlPcdXTw9ALK_EWQwZ13qq6UsPpinXaZpmDYpuVYEpcs9eIsnB6mCp8qNAxsi9hkF794kRRGp0-8kY1w22V5iwCAS6IwldnYQTuRpz5izcvVoj56o0jaIrAECgV-SqmJ99D_PK47F8zSkAyiyNwt583vGg0AdEskqrt6DjZkpNlSbfCyspACCb1VAOR_JJWXM_G_1AHm3XyvXCmnCc-KljfPH0xFT3eVYbmE-_VXSG9PiKFLEKyJNLzHqVGmRBuikYwpSMcaT_dtn7n3Yq8s3U_0SevzkY_AUU5V1ki9QFJXPV-xpIb1ZdJvlT0DmlGhdYVXfing_vg0DIMQPEFue7wvyepjhdriZPcrwa_5HEXko-oWRWa-_G8MVOK-khzVl3FpVlrsehAYSMlAbTm9bI0AgzHAlAr4ojQ==&p=12&fvj=0&vjs=3,NOT_FOUND
282,pj_fc1266929a4a953f,Chicago,business+analyst,Business Analyst,"Yoh, A Day & Zimmermann Company",NOT_FOUND,"4-6 years’ experience as a Business Analyst. Business Analyst needed for a contract opportunity with Yoh’s client located in Chicago, IL!...",NOT_FOUND,https://www.indeed.com/pagead/clk?mo=r&ad=-6NYlbfkN0DK_2vZ9EgcAccGC6GsNncjWNqkq9sVUS_FbvEJI1Nrv_ofcc5MGKLsZzLrqwWzH_nBPqANe4uXrczbFuc3WI9KwDqzelBqdUif0F_QwDFCzZLSv-rZXI5U6VNXNhhUhAazgFGS6BFrYtqt09LUUlAdbs_rFvZ0auK8hWxoQ6b3sepYqqQ1saRN-v5zS-xUahyoSK-wljq31Op4dK4ymgHC6O_Q_hl-ugOsm7JBk85ssFNCXpPPT08XBdFf0MMJNBi7BvBiEU8k6o_69m_UjAdFLz18p1rS3JtR-J0tiwFsK7yuc0YRmOtI64ryYlWxUEIyYYAkM5B9aS6H8o5UXOIAobdgBsEOhp2aQ6iGnOcD9b0DfWiTl0LddzHTalWogJOgjoKGA8b4RJMtgF92mrLXsXKFes3wUXh0KNSjE4y5VlZ7dabkGj6M&p=13&fvj=0&vjs=3,NOT_FOUND
283,pj_019afd79d8f66d59,Chicago,business+analyst,Applications & Business Analyst,"Justrite Manufacturing Company LLC, a parent company of Basic Concepts Inc. and US Chemical Storage",NOT_FOUND,Provide support to project teams with focus on business process development and strategic business direction while maintaining normal operations....,NOT_FOUND,https://www.indeed.com/pagead/clk?mo=r&ad=-6NYlbfkN0AWid2H6RPrKGcO0cqz4-fUlgP-QLUJ9RNEoqPG1FOoz2juXhaCiccTfrj1SHbTfh41tXahTicVvxzoqpd3sm4XgACGn7Y3HDmv129KuGcbnozxKvHg037GI5pF0gbeK8Vgcv5hLGF00ctmomVscpa8fvuptOJSJOrpTeABQt5g4n7dblmrLqvk-9bKdUGCs4XCvm8CeTqMwjoDwLA-FjMjCPacHXgla-UnK-SgYAnxbkZeUNL4uNuzhustCo7yU9JJ0TLSF3Pr2QU7xF83zG2FDbiPowFc6wnURMfeSVPKMbFzEzhPl7Cmfhaf4n15zK4AOO0fepleOAx9TEzxqOmoP4HCS-tnLQbt1tKLhGhetxlV0DHAVeAOqzBzJGykBaVSPeBC9rqoBEIMg5CbBJ3Ddky63iXGrwMIEhVZmxGfAeedPc4n5nZ79ss5rK6jCbHJyJ2sCgO96fMaoiydIgIKtA8qiUQ6eD_SII8G7uxCF1m4sC4uCvwH&p=14&fvj=0&vjs=3,NOT_FOUND
284,pj_8d9b1a81da978f73,Chicago,business+analyst,Business Analyst,Randa Accessories,NOT_FOUND,Define business process and technical requirements based on business needs. Bachelor's Degree in Business Management or equivalent experience....,NOT_FOUND,https://www.indeed.com/pagead/clk?mo=r&ad=-6NYlbfkN0CB62aE2MGzXFnW1Pk6wtobCKe0AzfbionFUwocSa0hSxv5NbgndFRQvsfA2be5ux1DWigRSiVWfaU8elfHm_z24dW5_tFk-r5x4K9oYUUzRshYBSbL5_PSI6ZANheMqjsN5tQIhZWtfjbarbTlBZAYOcLKylpf9nzMa1JCiywTUA_-pE8_EH_guCWu0bdF6AmrkLBvSIskNnoG78hfRr-fYC51LhHBl5ZwFHqJm-BEorNmoGO_wC7cFiB0rn5IFrTQKbPCygaOh6nXq3PbJW8ToidK0dGiP_GfPCh40d4tjWrodHCF2Lu999pVy7ijXLxSE_8na6anh5aMZcPVfdWnEb12ySz7EeplfldxNqtTR0ZV3x5aqtHjsX11DPZgmzIJs2wD_3iPCm3rmC0hYLffFCnTQJUBF-T8BKT45QfbA9dKtDNsQEVxwEPOiHZqCD-N_fZFPSL3xasVn-ZyLkPjQQZWcQWkC0nc0d7sPUmS-6NSBFnzw4hALOxTV9DfAvE=&p=15&fvj=0&vjs=3,NOT_FOUND
285,pj_edc59b9d2e20c932,Chicago,business+analyst,Business Reporting Analyst - Healthcare,Dupage Medical Group,NOT_FOUND,"Ability to understand end business need, research complex data models and create reports from scratch to direct business and operational decisions....",NOT_FOUND,https://www.indeed.com/pagead/clk?mo=r&ad=-6NYlbfkN0Ck9tLHwkWfEoxUitczklUtEb3JHaOoZd3oUK2oGwTq_zZqm3ieYVUw9ClbKyUjdtm3MhOabnW1P8cUfdzSNpCiB2Vbaypk3CUVMb0cK0zGaHd9MrGG2-p70CWXgIUycrKsMeAcAdTqlq22E9bXUXv4E9A5ZwIojwrYcW2aEEpJ1ht4trnbQDgyjgNNtdS6N5XFk9URg56jhHKc9y32ylrPhKwNgipwEAe9Mqr1vZCXZ9haT-L-ebufgIPVGc6UzxJx7I3QrIWW62hJwuIoTm-QqsPB-qqq7qqco6ibSkJ-L_z1Nq8_uHLXuezb7DO-bB1DRsiqtAmXv7IPQ3U6J8hdW-NYoYV0CZo4v0wO8vEzUnxGJ7BlTnQRs0JdceF5kG56J_AuBP8750d3Siv9hPsUpl5jUhslQODDN0NoFecXXLy3Gyj3cYHFXmK84xzxWDgXii-eq_y9P37_xAIFlNOK6FLPd-JNoZPIVAqxrQ6sVBWJAhyVA4u5BIKGleP-I7Lkj00ykU-4n56ZDzVo00b0GmNYpOBW4-YGczrKcUw0qpbUsaYj6VB-9NsHvziSALkXBVUdK3XXDg==&p=16&fvj=0&vjs=3,NOT_FOUND
286,pj_47f7830367a86c07,Chicago,business+analyst,Business Analyst,PCMI Corporation,NOT_FOUND,The Business Analyst is responsible for reviewing assigned business processes from end-to-end. 2-4 years prior experience in a Business Analyst role....,NOT_FOUND,https://www.indeed.com/pagead/clk?mo=r&ad=-6NYlbfkN0B3ZTyI1Hljm6wvKfsBMMtNR89vRE52MyuUldfnLWwAaXEKLi3flA6ejbAYWyeMH3Tw0lAsz0q9jmuzUMv_S4-KALI9ryNDYG1gp0TZXwnoq2fqr1boQesPQ3oNKkBZuA7SQSkMIn29tiUGWfzFLFhHWDtU6t_QpnJSPIDJqMeLqlMk4g79hQQxFcPLr0JVyN3vOhbELLMxc4oOi7kSgzG7KA8IxWdAFkeCpCsNGEkIvHziKjn9C3DWZZ-AfSKga_BCmTBJAOltyY0VIl9fAv8j-V0HUN5MC49a0SpQHT4auzshpi_Bg-NVkWgoxDcoYbBsW6bfSBWcmJOZtGeC00M0T4JybWzUQsXDIDsmBCsl6Xr6FCbRxgf0LZwFD6Dc_Cs44PLMzRk5rh1pjxpQ5DnZMd02x6pX5NsTXejHafQvMQ==&p=17&fvj=1&vjs=3,NOT_FOUND
287,pj_e7519628bcc97a07,Chicago,business+analyst,Business Analyst - Telecom,Pegasus Knowledge Solutions,NOT_FOUND,"Serves as primary contact between technology and business end-users in understanding the specific business requirements, criticality and prioritization of...",NOT_FOUND,https://www.indeed.com/pagead/clk?mo=r&ad=-6NYlbfkN0BlDjqqQdl65rZW6VJDshyxVflWgdT-HEBt3zXmHRd9iP6TMe9uGjeF8-mPk9cdATc1-cHkXBbHxI5GDSb0ivG6QJdPmBJdEcVXFOPTNtxIUNjgvxIp6QRjhTMLvcPNMqPO_nwFibirm7ebD8YQXgw3uP_brVv99Zos2xsRyylWHwmlJGGFfi-AkvsGZPb2fMSRng-OnnIrsn52Sl9TkEUOJ7ODIN9y-xj2ysV50k--KBUfTCEeILkg4Nxxnvu631mwhBt3vBk61OdRmaVVyDSgqML82ndkGHmWMns01S8cP9VvqWzR_jMAuBuRvMcWGtsdZeUPPaiQWPii-6394hfed9SaJsRH1rCOkZXrMwSUaAw8jGkijATWoTZ4DhXMM-WJNmdcFVY2dYK6CEMlF5_TCPDmTbym4_nM4vKdHydh6kbd4fpNIby5ZuicBKdsGxH1_60ugcDuOoehBBCLu6sjz949GbqZqz3HKllTdBJ0oMN5Eun7_UpSO0pWaTA8z8SE_4ViVu6Ig3YeK02ihyaB&p=0&fvj=0&vjs=3,NOT_FOUND
288,p_a05255038b680a2b,Chicago,business+analyst,CIMD - Marcus by Goldman Sachs- Business Process Management – Analyst - Chicago,Goldman Sachs,"Chicago, IL",Demonstrated experience in assessing and designing business processes. Maintain up to date inventory of business policies and procedures....,NOT_FOUND,https://www.indeed.com/rc/clk?jk=a05255038b680a2b&fccid=16a97ed26c75bf2d&vjs=3,25 days ago
289,p_6c731b8b824d6547,Chicago,business+analyst,Temporary- Business Analyst,Northwestern University,"Evanston, IL",Temporary Business Analyst. Northwestern University is seeking a Temporary Business Analyst for the Evanston campus....,NOT_FOUND,https://www.indeed.com/rc/clk?jk=6c731b8b824d6547&fccid=bc51f56762438d6f&vjs=3,24 days ago
290,p_4f545125419f97b6,Chicago,business+analyst,Technical Business Analyst,Johnson Controls,"Chicago, IL 60607 (Near West Side area)","Agile methodology experience, refining business requirements into agile stories and tasks. We work in an agile environment....",NOT_FOUND,https://www.indeed.com/rc/clk?jk=4f545125419f97b6&fccid=dacddaa4d49537d8&vjs=3,30+ days ago
291,p_497b1321e1c788a1,Chicago,business+analyst,Business Process Analyst,"Navistar, Inc.","Lisle, IL",We are seeking a Business Process Analyst to support our Parts Distribution Centers. We are rededicated to strengthening our core businesses....,NOT_FOUND,https://www.indeed.com/rc/clk?jk=497b1321e1c788a1&fccid=0f74910f4101078d&vjs=3,30+ days ago
292,p_21435378665b1bec,Chicago,business+analyst,Business Analyst - Strategy & Planning,Chamberlain College of Nursing,"Downers Grove, IL",The Business Analyst will be responsible for research and analysis to support strategic decision making in the healthcare education field....,NOT_FOUND,https://www.indeed.com/rc/clk?jk=21435378665b1bec&fccid=64e04953a008ff2e&vjs=3,30+ days ago
293,p_e9b2698699c65206,Chicago,business+analyst,Ambulatory Business Analyst,"Community Foundation of Northwest Indiana, Inc.","Munster, IN 46321","Associate or Bachelor's degree in healthcare, business management, or information systems. Reporting to the Ambulatory Applications Director, the Analyst...",NOT_FOUND,https://www.indeed.com/rc/clk?jk=e9b2698699c65206&fccid=9f655eda77e172a9&vjs=3,18 days ago
294,p_487a0f9f7c437b98,Chicago,business+analyst,Commercial Bank-Business Analysis & Reporting Analyst – Associate,JP Morgan Chase,"Chicago, IL 60603 (Loop area)",Business Analysis & Reporting Analyst – Associate. He/she will learn core business processes while leveraging strong technical business intelligence reporting...,NOT_FOUND,https://www.indeed.com/rc/clk?jk=487a0f9f7c437b98&fccid=c46d0116f6e69eae&vjs=3,3 days ago
295,p_80d0fbdda1ba6eb4,Chicago,business+analyst,Senior Business Analyst - Contract,VitalHealth Software,"Markham, IL","Senior Business Analyst - Contract. Senior Business Analyst - Markham, Ontario. We are looking for a Senior Business Analyst to provide support within the...",NOT_FOUND,https://www.indeed.com/rc/clk?jk=80d0fbdda1ba6eb4&fccid=7fcc30e58d45800b&vjs=3,5 days ago
296,p_35c89b0c58956e3c,Chicago,business+analyst,CIMD - GSAM US Business Analyst – Associate – Chicago,Goldman Sachs,"Chicago, IL",Experience with business process improvement and business process design. We are seeking a business analyst at the Associate or Vice President corporate level...,NOT_FOUND,https://www.indeed.com/rc/clk?jk=35c89b0c58956e3c&fccid=16a97ed26c75bf2d&vjs=3,27 days ago
297,p_67aed6665ff7591f,Chicago,business+analyst,Master Data Business Analyst,D&W Fine Pack,"Wood Dale, IL 60191","Service ad hoc data requests from the business. Experience with Business Applications (CRM, ERP and/or SharePoint) is a plus....",NOT_FOUND,https://www.indeed.com/company/D&W-Fine-Pack/jobs/Master-Data-Business-Analyst-67aed6665ff7591f?fccid=6bf404da2cac63af&vjs=3,24 days ago
298,pj_019afd79d8f66d59,Chicago,business+analyst,Applications & Business Analyst,"Justrite Manufacturing Company LLC, a parent company of Basic Concepts Inc. and US Chemical Storage",NOT_FOUND,Provide support to project teams with focus on business process development and strategic business direction while maintaining normal operations....,NOT_FOUND,https://www.indeed.com/pagead/clk?mo=r&ad=-6NYlbfkN0AWid2H6RPrKGcO0cqz4-fUlgP-QLUJ9RNEoqPG1FOoz2juXhaCiccTfrj1SHbTfh41tXahTicVvxzoqpd3sm4XgACGn7Y3HDmv129KuGcbnozxKvHg037GI5pF0gbeK8Vgcv5hLGF00ctmomVscpa8fvuptOJSJOrwB_5j5tec7Lxd5-H0AjLpRMMz4y1p_XRFCyUavAmGVz1Uh4c-A6zAJxOPMBEECbFdwRjsPg69a0YN3jbjWV_C_sO8lA772Ab01aLrTktswxW6BTcyJZGvn6KSmRdmGqJgkh5t8DUKEoP5r38D3K5S35TVJi79KXL8hi24vTRFNmwk8YevjAdewGmuuJQSBTg3SKq6sc8P0TWzyJCEYU67KNWvKeZllebXUpUZln7Cz9U3ap6bKZ8bCQSC5pzvTS5XSJyWuT0LhvEVQXpWW-18bVzlmSE5g8rlhBzbdrESqhCqmEjzj7ikts9Am5vWqvaFN5JEloo3xhGDanY9y786&p=11&fvj=0&vjs=3,NOT_FOUND
299,pj_9cca26ad5b2e628f,Chicago,business+analyst,Business Analyst,RL Canning,NOT_FOUND,"Provides business analysis for new and existing solutions to improve business operational efficiency, performance, and quality....",NOT_FOUND,https://www.indeed.com/pagead/clk?mo=r&ad=-6NYlbfkN0Cgav-NKNvmRMEzvMk9TbFvD66YMTkrfgm8JadoK0ruEMmIIfi4NTNURl-n4u50PLGhKMblgK-qHm0CKuVw3Gru_k21ZuT3beOkaPf7U2OnxWe9uQ3D6KS8xlLxx8JKg_pbWR-MOBtxzAj1d-w94n3yAzHDnrGVgwbemXsOUSvuFPpGaScBpGiCSODZMW-IpiQ2ie_ezvHl6bQGxPWoNMj6Ydb6XR58tZ5qLgRSAYwfK3aHNO3kqHCC0a3A549qlB0l2ZnfQn89X-pRQaWVGeLPIsOHGXxWBMmpUZx_BeWC6f3HQEDY6K7laSv5rb3XhO67KqJR1ULocB1aOg9tO2ogWiIq6vC-Cix2q2bbtpdNBzJlwUzMrCGSX4AJ-_LTKubLygIqEup7niHa9O2fI7v_6iNWYcoa6lURYBPRMF66UJE0bYh8Woa_lNQ8mrYSEVwOrC000bep9bE_WRp3Z5ZfXcCw4n5uYWpCOhcwXdD8RMcAQnQ2gjIXadKsIqgA7wtMyavl_YdmPTUnQjPaKjnoGtAsgHe2oevgHxlxrgzGYX13pW2wWrqswC0tYUCbAfDhJ0m9fLvEyAFVbFmojw03&p=12&fvj=0&vjs=3,NOT_FOUND
300,pj_fc1266929a4a953f,Chicago,business+analyst,Business Analyst,"Yoh, A Day & Zimmermann Company",NOT_FOUND,"4-6 years’ experience as a Business Analyst. Business Analyst needed for a contract opportunity with Yoh’s client located in Chicago, IL!...",NOT_FOUND,https://www.indeed.com/pagead/clk?mo=r&ad=-6NYlbfkN0DK_2vZ9EgcAccGC6GsNncjWNqkq9sVUS_FbvEJI1Nrv_ofcc5MGKLsZzLrqwWzH_nBPqANe4uXrczbFuc3WI9KwDqzelBqdUif0F_QwDFCzZLSv-rZXI5U6VNXNhhUhAazgFGS6BFrYtqt09LUUlAdbs_rFvZ0auK_Uknpq9ud2THR6-HoVVIARltLJIA2kZD6U_mO8StSBWGYmSsxnNyLX_xiuxvg8iZ46kURCWbuJSOXkBKTyMGMbD_WLzn6ynlJPH1oEjrXQZnouphJsvZj1t3h6soeCKZfPKuN_7LwitxsUzllIqqBkCgbm6ErfRfcOSjScdtkEk1HCIhn-H_tmWmtioqOb-8Ipx5J9THCCCkcqn9fwqrAFuXxkkPwGcs3HZc6NldYzzzgmrKpL2VT8EzCL7dbGmP6_zkgVc06ehSrTWP2vkY-&p=13&fvj=0&vjs=3,NOT_FOUND
301,pj_8d9b1a81da978f73,Chicago,business+analyst,Business Analyst,Randa Accessories,NOT_FOUND,Define business process and technical requirements based on business needs. Bachelor's Degree in Business Management or equivalent experience....,NOT_FOUND,https://www.indeed.com/pagead/clk?mo=r&ad=-6NYlbfkN0CB62aE2MGzXFnW1Pk6wtobCKe0AzfbionFUwocSa0hSxv5NbgndFRQvsfA2be5ux1DWigRSiVWfaU8elfHm_z24dW5_tFk-r5x4K9oYUUzRshYBSbL5_PSI6ZANheMqjsN5tQIhZWtfjbarbTlBZAYbKypuqrBC5mq8z84MNf4tV7Rkmz6EXnrZHhkDhWbacbc6pSNB4fEr7j7w7uZ_UBqVLJdzrMolVdYYFfSh6sJx6FctHA-OZsMTUyvvoK6ufGNEjs3oMcsUqSnZUtU8FLPDiIIBmM4xE7gOhi4SESg6l69cBpGzNlmGUVqQH87UzdA_xIjebxLuQ0HLy7shUe0Td8kl9e3t5TILsGaGI-Fq14ica7Cz_qJC0c7dB_UXYfO4DuFysGvpflCi23rrLsNBCPElAdBJMARk8mjWJ3MHmDGXh4jnsO945X-DXuXGJfdMECN-lYQyz_-yCJFBZA85g4FvgWF6XGh-ZBZbXgFiC8aF9hWOKo_MwNHZdzEOZE=&p=14&fvj=0&vjs=3,NOT_FOUND
302,pj_47f7830367a86c07,Chicago,business+analyst,Business Analyst,PCMI Corporation,NOT_FOUND,The Business Analyst is responsible for reviewing assigned business processes from end-to-end. 2-4 years prior experience in a Business Analyst role....,NOT_FOUND,https://www.indeed.com/pagead/clk?mo=r&ad=-6NYlbfkN0B3ZTyI1Hljm6wvKfsBMMtNR89vRE52MyuUldfnLWwAaXEKLi3flA6ejbAYWyeMH3Tw0lAsz0q9jmuzUMv_S4-KALI9ryNDYG1gp0TZXwnoq2fqr1boQesPQ3oNKkBZuA7SQSkMIn29tiUGWfzFLFhHFMx4J7ndNYpendXH3N_eNEd_WRgzrQhpn9drvS0NVkhnsKUA4Ju7DCX_O5zxLs_C9_ZJp2hX6wm-vr-mO0vY5wsNTLkmjrmKvbCLPNLDnNwsy1TFPjKSJUXtkFtiO_Td4MyFalxWAVv2tSln7Pmwx1V5VIUNMRubnm-fhigCZ32tCuww8moGMUCcCH5e_J0wIeHppHGLMNAUftg1_05JnKKPezSVCq8O1iwwPfzsZfpGdOAHylA3iIx_LpgidbFFYhVd08I40XXxVqd9ywQ4Uw==&p=15&fvj=1&vjs=3,NOT_FOUND
303,pj_edc59b9d2e20c932,Chicago,business+analyst,Business Reporting Analyst - Healthcare,Dupage Medical Group,NOT_FOUND,"Ability to understand end business need, research complex data models and create reports from scratch to direct business and operational decisions....",NOT_FOUND,https://www.indeed.com/pagead/clk?mo=r&ad=-6NYlbfkN0Ck9tLHwkWfEoxUitczklUtEb3JHaOoZd3oUK2oGwTq_zZqm3ieYVUw9ClbKyUjdtm3MhOabnW1P8cUfdzSNpCiB2Vbaypk3CUVMb0cK0zGaHd9MrGG2-p70CWXgIUycrKsMeAcAdTqlip-3Zu_4MOEnGa2OTFOWGhUfQeaRdO4QwmGM7CAEbEggDu3C4IVHopJbCx08WTgEbpza99WxyoM4XPC-CQ9GQePN9kcx7VB1XKqq0kqYcI7MoTmd7LrhxL0WXZsFt11P-aylp6In7S-k3ffMqOAu5Ms8WcdIK1KE8vqlYsMXc7beDQjMYTl4yQ8PrfUjc7bTR3YADt9WILn-iFiC4qhrFMIoC31gR2Z-9LtqkII0497kFY9ZLegoLIWuXIdbh7yoxWz-7yuFIQpKNKbQofDW61uTArLRcuB1JrvJZ2Iw1RPLUwfJSiRVFLIyma0oVYRFGrhUBJkg80Tp4suRJo0f89g4QglUF-j9cEucG3HUlRiENq_YpwW6OAzXzkBvf-aN3gFS22IX25dyAhCVq9b51JiyOr5_09S_ip6jSxg8kAik0cLT4dSz8fEKNwRyM3dAg==&p=16&fvj=0&vjs=3,NOT_FOUND
