,unique_id,city,job_qry,job_title,company_name,location,summary,salary,link,date
177,p_af52578d2961cf6d,Boston,data+engineer,Big Data Engineer,Avanade,"Boston, MA","1,000 data engineers. Deep experience in developing data processing tasks using PySpark such as reading data from external sources, merge data, perform data...",NOT_FOUND,https://www.indeed.com/rc/clk?jk=af52578d2961cf6d&fccid=5386281035076fdf&vjs=3,2 days ago
178,p_5aa73b7c981ae775,Boston,data+engineer,Data Engineer,Cogo Labs,"Cambridge, MA","As our Data Engineer you will:. Work with incubatees and teams to plan their data pipeline, optimize their SQL, and act as a sounding board for all data...",NOT_FOUND,https://www.indeed.com/rc/clk?jk=5aa73b7c981ae775&fccid=c9e769ff6bc13ee9&vjs=3,30+ days ago
179,p_b5ad117eac101765,Boston,data+engineer,Data Science Associate,Elemental Machines,"Cambridge, MA 02138 (West Cambridge area)",Build data analysis tools for mining IoT time series data and large scientific data sets. 1-2 years experience working on data science products/tools that have...,NOT_FOUND,https://www.indeed.com/rc/clk?jk=b5ad117eac101765&fccid=99b7ff67c7a78b44&vjs=3,5 months ago
180,pj_d400de46a546e4f2,Boston,data+engineer,Sales Engineer (SaaS/Martech),BlueConic,NOT_FOUND,Customer Data Platforms. 5+ years’ experience as a (pre-)sales engineer working with enterprise SaaS product(s)....,NOT_FOUND,https://www.indeed.com/pagead/clk?mo=r&ad=-6NYlbfkN0BIXk-KjEr2lbPrxl5QqpqLDYgEE8AgSm6_3MFsEPgmh5EuAkTrTghO57EFuI8jVmq8TyQje6-qT3rCi6xD2Drev07ND2BCRXojeBDdBi5157EJWHUHOCirRPPxok8QRKnL9KyZPWBIOUwZzfAQKgVX-hmbW67TGFVHL5ZKL1t9QAQgrxiYVlBKHVv_REquDbGceImsZMHit_9QvV3p8_zImJH2pdmTnBDvyCPrnKscfF1cQkegPaywRx6n9bEEWh4Ps0hn8uTSVqbcBE8pcsQ9ZIGtsMYztrvm2l2AugAslxF5R6nMA0t7wPSXnydeYjfU0MNGmlX0TRk64xr2plOY4H5SN3b7Rl1SF9TAzc-s4ZsckeHan7WncuQgPvlPHMOhhJibWkn1oaUky38wXMkQE-WYIuCVro9Q6jOvUxfEPAy9nrrZBmDM95zZvfXKWI4=&p=10&fvj=1&vjs=3,NOT_FOUND
181,pj_0ed122a2e7b996ec,Boston,data+engineer,Siri - Senior Data Scientist (Machine Learning & Natural Language),Apple,NOT_FOUND,This role also involves technical leadership and mentorship of data scientists and machine learning engineers....,NOT_FOUND,https://www.indeed.com/pagead/clk?mo=r&ad=-6NYlbfkN0D4BtUbIrDMkalq6ptvGBorBWk-T6D_x1TipmER1OxNA9z07-yGEh2dSWRzX8wqAptVrDOq-s0mSesalBIvFypImfCctj9N_TvBdKeS3t9jw6AA-Hcvrchtelz0UTFWgSzLghv96iT6uB-znTYvn-wR2y9GDNUbiGZcHI7w9tH2dcXek18fjYTWYXIykLlNmVT0YW--Eqic2SCxP68UFgW3wCU1t7EK1oXaap4f-sLPUKZsfhVPWn48ZYHo0u_E8Fp6-T3UKVq-ocPZI4NAW14KmMXHkXqBu7oDhbcoUTSYEsfrcIw_H8nz0iM-PTNI7PATFbfh3V4UlhtX52NAo7IdMseyQMUCDTl5QldWcHbEAX7Zpm6nknqdj5G-vLYBscO8-q6vzuKMdYG8-nu97YFCJqjc4vw1WZbdNG-Y3wepuS6sJdir73Mxj3oeTxUNNj1RHlu3r_x5yJnOI2kcNHmrHX9AWi9qHKchUlj-G6CuXsDmBou_opkXXNWiP3BmyZorJ7cazXds1_No_rDWsxgjo_nOER6RgIwURDnWWKmgH-Imu2DL5YuxrURM4rvsUSAdidoO2seXFFp__Vbsac-iMWfryt0oPUIKwNkWWH2Dl8ATux3V-l6RSuKjJbPARTFTCNggJQV5OjvJhUN0o5pl15aFjuIsRJZSOUZZ_UQ1wA==&p=11&fvj=0&vjs=3,NOT_FOUND
182,pj_7284f97476394efc,Boston,data+engineer,Senior Systems Engineer/Data Scientist,Cenergy International Services,NOT_FOUND,"At least 5 years of work experience with 2 years focused on Data Science/ Analysis (e.g., Data Mining and Processing, Building Analytic Systems driving business...",NOT_FOUND,https://www.indeed.com/pagead/clk?mo=r&ad=-6NYlbfkN0BbyS3g3l0OnpNvA1X8G22NJOCiqpCoEy0AiiwsVTMfNEChf2Nt7d0n385_i-_sP9-4j7BZ1p7Fv2Bx0nzpwgPsLbSq72mZ_gxwdBW3Jku5LMYiqn95yk8eKaXADs7e1NnksDpaVHTWVujPjW7-JgmZ6rN355VZYnfPWH98eq9wxgeMUIWs6Kf_hbn2bgReT9pbPhdOrWKnzOoH7V-cgRzMi2LX3li8YPI-3JAehswJ74b7Gf-L_qTJwF1n-rX52XExOy3Gcf-zO1advuS-wWOBm6Arh92WzIpDq87xPQGkWChj_sZl9KqJWagu8zE-052oFrZxIkUNIOT5vZEfZhONhlZ5S3jZ_f65dzSzDLlKuN4HKzmUumL5112LRdFrhFouV4QAkFSqPkt126y1uiePhr854l39eNx_DimHKHwEE_n0bXbWUE9QJoXwJqqJdO9vINXikF780g==&p=12&fvj=1&vjs=3,NOT_FOUND
183,pj_4cf706310e6f3330,Boston,data+engineer,Product Marketing Engineer,"Sifos Technologies, Inc.",NOT_FOUND,Sifos is the industry leader in the test and qualification of equipment that utilizes the expanding Power-over-Ethernet standard for combining high speed data...,"
                $70,000 - $90,000 a year",https://www.indeed.com/pagead/clk?mo=r&ad=-6NYlbfkN0BH-Ox1QkPFMCkX4MhMorLi97ErmB4kRLTJPdbKUhezxp0F44gdSh8FwCKSUNNtJujXX56ezXPst39saFHqi2Kv8Gx_GShHfzg_NIkYDNJmVuKhGsYhIdJs0OX_rEVXKYi-3y1OcqfwXBfI_oPlJot1hzn29UmBT-TT0uLWXYk0OkA5SGGaxixsLqaVmy53eyKw-56xS91SqBMBETkHqIMcrcojfRJj0kOfgI8JVzaq-c7rZxMLr_oq5PUdZg_PePb_i8Kiq1Bjo7OcBv_pPjpzB2DFZ7tLD_jNVionp67vZ-hoDJt9AiN1pBo3GkP1Fc1sAWQyeByyPTukyOlKlt_el_wljt3wVcK5YANHHNrifnOeFeg0WOWQ3E97RC-Q4bLFQV-U1sxdW6I4zRgwu-MSwvz6X35REXZg_QsK9aUFMrBR-0BVQj8b_MwwvMAqp98=&p=13&fvj=1&vjs=3,NOT_FOUND
184,pj_2a7e5cc36166b0e2,Boston,data+engineer,Jr. Transportation Engineer,"RL Controls, LLC",NOT_FOUND,"Ability to perform technical tasks and data analysis is a plus. Coursework in Transportation Engineering, Statistical Data Analysis, Technical Writing, and/or...",NOT_FOUND,https://www.indeed.com/pagead/clk?mo=r&ad=-6NYlbfkN0Aousd15sYXrhf4YXk14MwJxuY1ivfOO-TlskXG7y3ogYefHmoL1KdawZu9DmEK9MRPtXb1eBQXIy3v_jY-OxE8YlwYcWfvFeN8rEw5-du8GJscAaJbJvDDKqN_lHxN1_TUkEG2ESu7W89WMEkSJEgWMCgY3xQMN6OkSMc-EsTaCtARaE3lLc9zcLv-BYY7zQuXSA4wTntAja2VTuII2DpiCVttdGqOsc3tZcaAVJpgqB-XCm-aIcCMrMxM_hkPQgSxUhSMQ0ahY0i5UPvGrPmFhpQWr-KzYt9IfptnNqvrmapzgCGas2ZxfT5HUAZiy59A9CkxBzDOpN-hhR5m8IXIm2egGxsMy0SzJg0pXnivQNKMOGPa5vwYcUcTMoDJwk0xPI_YX3jX5PnFA4Ik7zm3PJodopfNSanV8uoVl0IadroKyU4PIJNc8iEe6b5Irto=&p=14&fvj=1&vjs=3,NOT_FOUND
185,pj_79cf28cf1a59a2c2,Boston,data+engineer,Data Architect,Wayfair,NOT_FOUND,"A data architect builds the foundation of Wayfair's data ecosystem, partnering across engineering and business to ensure the timeliness, cleanliness and...",NOT_FOUND,https://www.indeed.com/pagead/clk?mo=r&ad=-6NYlbfkN0BWKOYaUJfzlpbj8B4EVHsr8Rk3do3CBb7WzQD7M0cgO4MmQYBeubwD0nUaCahAaLhz3rqYe-iK6Wc0QxBMD-_Wu2HLMLhLJI-Y3rzxcZRSwY9fvZs1Y3uJcPW6XOcaYD75fKkB1XAJkgT9KayCvVWRaZFi1Vl82UphmyDcXYMjlcX_pe_mXz1z2Y0eeC6LdOczOGgxFsdB2fL4_mk7u4xKFzbcIxUuNzr_YmIUoAXgILk0gSIPV-yMIageOh3tgGUWkAEC0MpTZ9DT-kaBZRsPJ19UF9xQBBYnaAH6uP3y71LWQk2mES6k_trUudznbYkk0UMjPFjW_XHKeNJKLviIAJJyU7ZDLT-rqBiYsZZ84Q9B09t52ENsZIZ3o3vP4HObBNHLR8L9lQvSjWtlBVVzYBIj-U-SsMDV4OiZYJPQ25BA1cqOyxmioDfZATj0J90hCVCReMUj68TFuzTVfKxV0hN5j5TNTlxZqHAGbnOZagTXVNKvC3aGcnrLYshj28YWsQsaoeBWVQm6cmuAhlDWz-kkbMvpeRKTOQGdaQlN294zdhFifzHZJ1t03WiDxzQ=&p=15&fvj=0&vjs=3,NOT_FOUND
186,pj_3df7033bbe451c67,Boston,data+engineer,SENIOR DATA ENGINEER,Benefits Science Technologies,NOT_FOUND,Improve data validation and data quality monitoring. Data security and encryption:. We are looking for a passionate Senior Data Engineer to join us in building...,"
                $120,000 - $150,000 a year",https://www.indeed.com/pagead/clk?mo=r&ad=-6NYlbfkN0Bo83FT8hN2PCWuwik2MfjabT6etR7Ty3Eig64gwmZDXFBwUJEQdWreFWKElPOydQh-Q_EzkiS6fcSmglBjKMPhzIwwN63qzrSaICM5nTLmslg7L7pncS_gEyhGyALI7S84-ugBTEmzcXrHyJVVgO1pdoCBV1mVQgBlbEQoUB_ZwNn89t7mhiKvDZnzRCLdGg-MVAndsUzAzbhdrK7l5XbuO1u432cjZThXGlNXXtajh7dx_ZX9FzkVTNiYJcftGTo_n6XcaHC4fOA4EjhjCBJEo9sYr7AyUFk2An4DbcwlQGHYaAt2beZQ1bf9sPTxORTQ-T5KiblnQ5HewBX3ue1OT2RbLe2Gm4T8BAmDnMSogtg1AX4B5AEOJ7q5mevFYbZasfh8g2M2JIDn36gTa4DvZrrJmiu-iQKBj0d-mOT_cCdUghDccxR7&p=16&fvj=1&vjs=3,NOT_FOUND
187,pj_c98d1ce3ee653cc4,Boston,data+engineer,Junior Helpdesk Support Engineer,"Bay State IT, Inc.",NOT_FOUND,Communicate with Helpdesk/Field Engineers. Some analytical ability is required in order to gather and interpret data in situations where the problems are...,"
                $38,000 - $44,000 a year",https://www.indeed.com/pagead/clk?mo=r&ad=-6NYlbfkN0Aq7V8qbMAPCPg74Ici3Ykfl8KCDQgSE3oM5G8LA-BPGL4P7_NeGmqL6h56dgQ3yNc-yB19iAVZTppDacNzSLfgmnOkXuTdxUZimUbUSIOtclpF8Q6JmzeexoW_JNxtMhavoVKqDuuK7mtrLlFitj7PR9pnsn5fgt3iWtW9ztjKd0Ap2jXeBtI-Up7_Djm_02kyEwR8q2Bln5iDuzoHlPQUbjZTdK-FStBjwmM6l0r95FJgzQlmC6hqQQfBXk8N_JzZ6Cihr1EQy138I3hwY6ecJkanurBtSEmc0yyjm4ctQjHEw1oaiqMLcpaW6ggCSttq02FoPzQwXkn1aMYD0c1886vgHBK2MWztyiIZ3oZAGjb35Jwz2idX8WKD-i1iD2DLfVuVFu3WOMYIo5IIZKXuavZNRZjLk3_hG4xnJ9zBLm8GzDiYFvJuyCgbPaiPQek=&p=17&fvj=1&vjs=3,NOT_FOUND
188,pj_c3bc11267ccede5a,Boston,data+engineer,Data Engineer,Sea Machines Robotics Inc.,NOT_FOUND,"Manage and perform data analysis to identify data quality issues. In-depth understanding of database design and structure principles, data management...",NOT_FOUND,https://www.indeed.com/pagead/clk?mo=r&ad=-6NYlbfkN0AHdFIJfBLGYbx_TzBCBsgbK0Due77H36xmGRpY2MfZsPwTPTh4aSQRFNCGEArHnMvviCNe5JnuWNMqtdZcBvIfU2yZuPy0QwO0-wkoQzNojCcEfroTLtF0vikT6bN9EMogcSG1Aq6SrRcAZCVGhDs0Ix9Rr1aQ5j3UwaQF6-HH2j32hqtr5VQPpkVA5fIMPCV4HdyL1osYq7ILHbzhNe15EnorWcEzg_hMzE5DpkgS-PFfHKgcQMiZxspGf2VMUkCo5BPAuyVA7D6Rsfyu6y-HK1aTD3n_lntdhDOcXNGQrp3G6vzgbZz2JoKJBxIhA5cNtBAo4vAixiTQgU0pcCwNYl7tVfbt8tONez3LEQp33tKwWpOm0_bjLyfQWyuaj4p11iY2HvNnSZZ4ecrGOKU-sB9eMEHpBuNIAI42Z0eteQ==&p=18&fvj=1&vjs=3,NOT_FOUND
189,p_fa028d7b19c1ce6b,Boston,data+engineer,Data Engineer,Quantexa,"Boston, MA","Proven big data experience, either from an implementation or a data science prospective; Manage, transform and cleanse high volume data;...",NOT_FOUND,https://www.indeed.com/rc/clk?jk=fa028d7b19c1ce6b&fccid=db092f8b7448d6e5&vjs=3,30+ days ago
190,p_0c350a1be1ad6cd7,Boston,data+engineer,Customer Facing Data Scientist - Telecom,DataRobot,"Boston, MA 02109 (Central area)","Enabling customers to solve complex data science problems using DataRobot - including problem framing, data preparation, model building, model deployment, model...",NOT_FOUND,https://www.indeed.com/rc/clk?jk=0c350a1be1ad6cd7&fccid=ccacdb1cb7d4a077&vjs=3,6 months ago
191,p_748ea405d494466d,Boston,data+engineer,"Sales Engineer, Data Management, Google Cloud",Google,"Cambridge, MA 02142 (East Cambridge area)","Deep expertise in disaster recovery (DR) and data backup strategies. Experience with data migration strategies, moving large scale production systems either in...",NOT_FOUND,https://www.indeed.com/rc/clk?jk=748ea405d494466d&fccid=a5b4499d9e91a5c6&vjs=3,30+ days ago
192,p_21cfe8d53aa4404b,Boston,data+engineer,Senior Data Engineer,Perceptive Automata,"Boston, MA",We're hiring a Senior Data Engineer with strong programming skills to help scale and optimize our data pipeline....,NOT_FOUND,https://www.indeed.com/rc/clk?jk=21cfe8d53aa4404b&fccid=a2b1f7c3f77a78d6&vjs=3,24 days ago
193,p_60fe9c42b0533173,Boston,data+engineer,Associate Data Science Engineer,Staples,"Framingham, MA 01702",We are looking for an experienced and well-rounded data science engineer to join our growing team. Design and maintain Transportation database and data...,NOT_FOUND,https://www.indeed.com/rc/clk?jk=60fe9c42b0533173&fccid=2c749d549b16ad16&vjs=3,10 days ago
194,p_9a0a6820df8a3291,Boston,data+engineer,Machine Learning Engineer: Broad Data Sciences Platform,Broad Institute,"Cambridge, MA 02142 (East Cambridge area)","Machine Learning Engineer:. Broad Data Sciences Platform. Eager to leverage machine learning to combine different data modalities (time-series, sequence,...",NOT_FOUND,https://www.indeed.com/rc/clk?jk=9a0a6820df8a3291&fccid=b8295c348463e6f3&vjs=3,30+ days ago
195,p_c2feb4d03280f268,Boston,data+engineer,Space Planning Associate,Beth Israel Deaconess Medical Center,"Boston, MA",Maintain space and occupancy data in the Archibus space database and provide support regarding its use and function to Facilities and other BIDMC staff who have...,NOT_FOUND,https://www.indeed.com/rc/clk?jk=c2feb4d03280f268&fccid=e22cfd26c0a5b241&vjs=3,4 days ago
196,p_ccba71ecc7fb728d,Boston,data+engineer,Data Scientist,Trianz,"Boston, MA",You will also work closely with data engineers and modeling analysts to generate seamless business solutions. Ability to tell meaningful stories with data....,NOT_FOUND,https://www.indeed.com/rc/clk?jk=ccba71ecc7fb728d&fccid=65a841a7f945806c&vjs=3,30+ days ago
197,p_d5f4d489e49b0b35,Boston,data+engineer,Data Engineer,Zylotech,"Cambridge, MA 02139 (Area IV area)","Architect, implement and deploy new data models and data processes in production. Orchestrate APIs and automate data processes....",NOT_FOUND,https://www.indeed.com/rc/clk?jk=d5f4d489e49b0b35&fccid=9b6fd8ba62b8d1b4&vjs=3,7 months ago
198,p_c314c6f6d0797c62,Boston,data+engineer,Senior Data Engineer,ezCater,"Boston, MA 02110 (Central area)","We push ourselves every day to get more data, create a fantastic data analytics and data science experience for our users and craft real-world solutions to...",NOT_FOUND,https://www.indeed.com/rc/clk?jk=c314c6f6d0797c62&fccid=78da2ac6605fb492&vjs=3,4 months ago
199,pj_d400de46a546e4f2,Boston,data+engineer,Sales Engineer (SaaS/Martech),BlueConic,NOT_FOUND,Customer Data Platforms. 5+ years’ experience as a (pre-)sales engineer working with enterprise SaaS product(s)....,NOT_FOUND,https://www.indeed.com/pagead/clk?mo=r&ad=-6NYlbfkN0BIXk-KjEr2lbPrxl5QqpqLDYgEE8AgSm6_3MFsEPgmh5EuAkTrTghO57EFuI8jVmq8TyQje6-qT3rCi6xD2Drev07ND2BCRXojeBDdBi5157EJWHUHOCirRPPxok8QRKnL9KyZPWBIOUwZzfAQKgVX-hmbW67TGFWRIEfBAVlEdDT80d0Vd_WRvJ3WxqJ6IUffjPJ5MUxVOYWYzBH35dyCrCOm80Wc9yeCrNEG1UpbPXHupa2Sb0kMPoVlrLf4uhmbCjwhkt8rHC6cT3CQtNsTWJE4zoyRFsVKCaht4QCdfzjkqZ6rKzL5-bWQW2wAzkQYtArUawVrq9x6RAhiGGoIyHpkdphkcZnJEjxQqhrYFa6RzDp0Efyl0dc1E257gNEYURnD4khrUBffN-6Puealp4tzCBWNuGzEOiT1nu5BkGYLx3maXM4uJ_Qe-I3PQic=&p=10&fvj=1&vjs=3,NOT_FOUND
200,pj_0ed122a2e7b996ec,Boston,data+engineer,Siri - Senior Data Scientist (Machine Learning & Natural Language),Apple,NOT_FOUND,This role also involves technical leadership and mentorship of data scientists and machine learning engineers....,NOT_FOUND,https://www.indeed.com/pagead/clk?mo=r&ad=-6NYlbfkN0D4BtUbIrDMkalq6ptvGBorBWk-T6D_x1TipmER1OxNA9z07-yGEh2dSWRzX8wqAptVrDOq-s0mSesalBIvFypImfCctj9N_TvBdKeS3t9jw6AA-Hcvrchtelz0UTFWgSzLghv96iT6uG-bxkVU0XOA7R_1IWVwMAUw1_TBdPub6xdA6FebA-4GNp2wzbt5QclH9WsTYlkUENfiLznncm0aLccsjKhWRQoj4Y1sAsdjoGfAr0L2ZBfRoeYXFTSRInoo2KRdA3Rh7DHk2EsQgiFimjpNgQfCOBuMmiGPOka_pskOWt2d387R3vdAZ7kZ5XXdMdUdw9Bg_MDkIHcz3hJSNlFoJ2UGDvSWvMacg1qj5e4PMZimNBO6TffP82b84b5j9fAIz8_U98ythS1whIFK8rKdQAeLGlM0IZTc5CzOar-nW1Vu4fuALQxixvRG8WWHKxSa929grxDV2auoRLAZp5m0tve3lc5Vn5TflmfUP_dd16ZustOp_MvAZTK2_xuW7TT1QE4U-hbB--Q7a1uZiX7xWv25P4LRkHFgqCRUgq6nl_XpHhmjnauo20dOb516nfCWAAx-8fqDa8bfFwrnRpVItgo81uhP_6MVDjZX7gQSHeywU6Z67yBl0tDIOeULpUSLO9-gycmSykiEQkdbZHxiqGtzF_Pe_S7PLJUEOQ==&p=11&fvj=0&vjs=3,NOT_FOUND
201,pj_7284f97476394efc,Boston,data+engineer,Senior Systems Engineer/Data Scientist,Cenergy International Services,NOT_FOUND,"At least 5 years of work experience with 2 years focused on Data Science/ Analysis (e.g., Data Mining and Processing, Building Analytic Systems driving business...",NOT_FOUND,https://www.indeed.com/pagead/clk?mo=r&ad=-6NYlbfkN0BbyS3g3l0OnpNvA1X8G22NJOCiqpCoEy0AiiwsVTMfNEChf2Nt7d0n385_i-_sP9-4j7BZ1p7Fv2Bx0nzpwgPsLbSq72mZ_gxwdBW3Jku5LMYiqn95yk8eKaXADs7e1NnksDpaVHTWVujPjW7-JgmZ6rN355VZYneWYVez4kX3POd9ji2CmxQF7-AMDqECOfT99u8uVPKmcXRMYAph6E1BiQeVEebrCDviASl4c7pMr8PJbVkT3CuX5bdCq7Toim_gIyPKtq5GChgz_cyvMsbf8relR1teQIUiCN1-FDtT8yJMW24vsRmalPtMcMYwMCyFhJtv3s4WwAEUAvAKrXRD0YRBDC5IMQXrL1Izoq7usFBYPXtLh1rFBKmVD6iqYvx-T9UM1P733pmVKYFPLxGM0MsjUlQyKIj2ja6czEE9YejF2CRwQmnJeOZdrKMVMkXz6-Mdb_CEDw==&p=12&fvj=1&vjs=3,NOT_FOUND
202,pj_4cf706310e6f3330,Boston,data+engineer,Product Marketing Engineer,"Sifos Technologies, Inc.",NOT_FOUND,Sifos is the industry leader in the test and qualification of equipment that utilizes the expanding Power-over-Ethernet standard for combining high speed data...,"
                $70,000 - $90,000 a year",https://www.indeed.com/pagead/clk?mo=r&ad=-6NYlbfkN0BH-Ox1QkPFMCkX4MhMorLi97ErmB4kRLTJPdbKUhezxp0F44gdSh8FwCKSUNNtJujXX56ezXPst39saFHqi2Kv8Gx_GShHfzg_NIkYDNJmVuKhGsYhIdJs0OX_rEVXKYi-3y1OcqfwXBfI_oPlJot1hzn29UmBT-SvOvIL8yOackYVA0on9Qxp4DeY0GfwIkh78GDQYBWdtnp8vh2CjbuzxzlRDCSEpkqQIkzkz-fJ987a94m39i-wVBIAUfJ4nBaJFa9MkKfW51oxlot5pF3IGJz0Wo7YfKq6lBmnUjOPtQ6CcJj87TUy1Tq6NQ5PyMQDrk-1fui-FYFwdZxL0UAkcJf7HuFh1b7aiA5p0JX10tisaqxeGTpG7lEwWNXa5EcUKCXcsME2znsgfX6PLe4sNpkyrHeKErzedmWRk03Xi0LO19Q09K4pCIKVy7Y-xaQ=&p=13&fvj=1&vjs=3,NOT_FOUND
203,pj_2a7e5cc36166b0e2,Boston,data+engineer,Jr. Transportation Engineer,"RL Controls, LLC",NOT_FOUND,"Ability to perform technical tasks and data analysis is a plus. Coursework in Transportation Engineering, Statistical Data Analysis, Technical Writing, and/or...",NOT_FOUND,https://www.indeed.com/pagead/clk?mo=r&ad=-6NYlbfkN0Aousd15sYXrhf4YXk14MwJxuY1ivfOO-TlskXG7y3ogYefHmoL1KdawZu9DmEK9MRPtXb1eBQXIy3v_jY-OxE8YlwYcWfvFeN8rEw5-du8GJscAaJbJvDDKqN_lHxN1_TUkEG2ESu7W89WMEkSJEgWMCgY3xQMN6N0vWbntjhSWhNDBgDfxt9pJQNiPjBlEAfo10YI0hcvz6L1BwPfwe0-mrt3eZn5EdlWkbDigyKpIQDirO15wqsC9IbP5lpRPCKQzOXJRf0esuVSdYMHdKU8TO49bYgK9adbcVQW8y7lKWWcizQMYJYDSJX9oslZgUJDJeFjyu_iZzY-AuhR8eSb-NQ0IJy7arJKay74vEBX7j9C8uwJUROIr-yjXoQEiUToSIFYS_s9xDAjXPPgHPTsn9lBgcht7tGmUlb7mm6Mol8qrCSzxmOJD6Cki2mx9Fw=&p=14&fvj=1&vjs=3,NOT_FOUND
204,pj_79cf28cf1a59a2c2,Boston,data+engineer,Data Architect,Wayfair,NOT_FOUND,"A data architect builds the foundation of Wayfair's data ecosystem, partnering across engineering and business to ensure the timeliness, cleanliness and...",NOT_FOUND,https://www.indeed.com/pagead/clk?mo=r&ad=-6NYlbfkN0BWKOYaUJfzlpbj8B4EVHsr8Rk3do3CBb7WzQD7M0cgO4MmQYBeubwD0nUaCahAaLhz3rqYe-iK6Wc0QxBMD-_Wu2HLMLhLJI-Y3rzxcZRSwY9fvZs1Y3uJcPW6XOcaYD75fKkB1XAJkgT9KayCvVWRJXVnP-Sv0p7nSV3WKBKocEzRQIivfHRE_WegUnPtZ6KFruhPerpM_ogvb4f461naWZJIIZAjpKe3cm1EKmy_QXcncRcP8XWpJ-9-qp5wxXIo52SPrlvaaULfWbBKsgCRoDbvL3onsYGJs87n5JoDqmKtavBAK-2sCAMI3C2anLXHCAGI4lOvw84cCKf95DFQkNJUUwcVLwwVD8kh3jiZR9IAveYx59eU_lWWV2vM0QIsy2UqbUTVvmiII8sQeRi_OSIC9SCQZhbGVqkxu6A-gJMLnsp_d-Dg6CFxMo6Z2RE9j8vN7VikHiXd51nIO30qq23LRJwGiEOUVfd_guE0cUS-WKOPM5w6bz32e5HMDZ_DdD5MnWA3IdP79hQJtyWrm2FEUQqQq1bLKP211yxpOSN4ocDxHiA7kRfDziuI6SU=&p=15&fvj=0&vjs=3,NOT_FOUND
205,pj_3df7033bbe451c67,Boston,data+engineer,SENIOR DATA ENGINEER,Benefits Science Technologies,NOT_FOUND,Improve data validation and data quality monitoring. Data security and encryption:. We are looking for a passionate Senior Data Engineer to join us in building...,"
                $120,000 - $150,000 a year",https://www.indeed.com/pagead/clk?mo=r&ad=-6NYlbfkN0Bo83FT8hN2PCWuwik2MfjabT6etR7Ty3Eig64gwmZDXFBwUJEQdWreFWKElPOydQh-Q_EzkiS6fcSmglBjKMPhzIwwN63qzrSaICM5nTLmslg7L7pncS_gEyhGyALI7S84-ugBTEmzcXrHyJVVgO1pdoCBV1mVQgARbxmNY80XkdnPk7R47qGBEu4scOYS0Vz2-VYct2eLd-kVpkvHRlqAgyXJrqIv-R5iiPuMA9qlaH87huo-zrdtZ9a-pKS-HnL9nB1pHJr8TWK9BG_UJ0D_lVjgn7lF8vjsoMsR6VvzdIz9ub-2m52I5fYd5eApeWtAzJHbhpNPqDccnnxhDTdGpi7VruyS1V0_mibp8lqDg_2qsvKL0DDPA31yMFv-HYb3eEkBWP62TLWtRVIfC-9FWaHOi2fWJbJu-d_td0suudyU93t9gfiV&p=16&fvj=1&vjs=3,NOT_FOUND
206,pj_c98d1ce3ee653cc4,Boston,data+engineer,Junior Helpdesk Support Engineer,"Bay State IT, Inc.",NOT_FOUND,Communicate with Helpdesk/Field Engineers. Some analytical ability is required in order to gather and interpret data in situations where the problems are...,"
                $38,000 - $44,000 a year",https://www.indeed.com/pagead/clk?mo=r&ad=-6NYlbfkN0Aq7V8qbMAPCPg74Ici3Ykfl8KCDQgSE3oM5G8LA-BPGL4P7_NeGmqL6h56dgQ3yNc-yB19iAVZTppDacNzSLfgmnOkXuTdxUZimUbUSIOtclpF8Q6JmzeexoW_JNxtMhavoVKqDuuK7mtrLlFitj7PR9pnsn5fgt1R0RTYrpqSRvSVYQfkcEsprk50JUf548MUnTU-4dEESXho0PNkiAqLNkh630DUbE96e-uiw1r-Iby2c4V5Nouk4jHkTgy_9ct3k37S_-V9Q3NPclqv4e6OogUbixDHaTtMCVsVGNnakV9BfBZxmck3c6fD3hmhNT0ZiSaEvmCAUTjF_BS6LUVr3aXbHz5gP0UI8Mlje_zs344Jc-Tja5gjpxC8XFarQsAq2Ev1Fn7i_wQ1gFGHX_NxkfbC1tHxS8LJWv2uAL08yc0p8Ky6ocpRqQlmypG3Yw4=&p=17&fvj=1&vjs=3,NOT_FOUND
207,pj_c3bc11267ccede5a,Boston,data+engineer,Data Engineer,Sea Machines Robotics Inc.,NOT_FOUND,"Manage and perform data analysis to identify data quality issues. In-depth understanding of database design and structure principles, data management...",NOT_FOUND,https://www.indeed.com/pagead/clk?mo=r&ad=-6NYlbfkN0AHdFIJfBLGYbx_TzBCBsgbK0Due77H36xmGRpY2MfZsPwTPTh4aSQRFNCGEArHnMvviCNe5JnuWNMqtdZcBvIfU2yZuPy0QwO0-wkoQzNojCcEfroTLtF0vikT6bN9EMogcSG1Aq6SrRcAZCVGhDs0Ix9Rr1aQ5j3JONEgNTyWYDFtVD8F2bQknrsGUSP_q6u4Kp3nv2VfKpYqyu_Pz3MSPWOT-S-KCr2W8_V07e5bdOYVrC2DXB1VJ91I6RaEvxXDVg3kVvQp1HWjS_5gc0L32j5DHeUz190HgfuHJ3bDs3DFI1kq7EBk4V7iunxv5s3sVX_Jbp6uxkY4Hhr3W1RPrHAHJagbF0QIzSKJVTtN3v3vmZob6CYYQnifQXvNhOP0t6X0flH_4LqUdGxR6fd42rQC5txU5GpWorZHCGi04Q==&p=18&fvj=1&vjs=3,NOT_FOUND
208,p_c314c6f6d0797c62,Boston,data+engineer,Senior Data Engineer,ezCater,"Boston, MA 02110 (Central area)","We push ourselves every day to get more data, create a fantastic data analytics and data science experience for our users and craft real-world solutions to...",NOT_FOUND,https://www.indeed.com/rc/clk?jk=c314c6f6d0797c62&fccid=78da2ac6605fb492&vjs=3,4 months ago
209,p_a194c462238d357e,Boston,data+engineer,Data Warehouse Engineer,NEW AGE SOFTWARE SERVICES CORP.,"Boston, MA",Data Warehouse Engineer. Experience in data warehouse design and data integration methodologies. 3 to 5 years of experience integrating data between operational...,"
                $106,000 - $159,000 a year (Indeed est.)",https://www.indeed.com/rc/clk?jk=a194c462238d357e&fccid=3b561d5866d7ff13&vjs=3,30+ days ago
210,p_fc66896bd128e2bf,Boston,data+engineer,Data Engineer,COTA,"Boston, MA","Cota is looking for a Data Engineer to help us architect how we ingest, store, and query data across the Cota platform....",NOT_FOUND,https://www.indeed.com/rc/clk?jk=fc66896bd128e2bf&fccid=0950181599f58650&vjs=3,6 months ago
211,p_292737ab96cc6699,Boston,data+engineer,Data Scientist,TDMK Digital,"Boston, MA",We are looking for data scientists who will be able to work in a team composed of data scientists and data engineers to support a variety of software...,"
                $90,000 - $139,000 a year",https://www.indeed.com/rc/clk?jk=292737ab96cc6699&fccid=ca4b14dc1f54d1cc&vjs=3,30+ days ago
212,p_c42b4332e7a6f1a7,Boston,data+engineer,Data Validation Engineer,ClimaCell,"Boston, MA","As a Meteorological Data Validation Engineer, you’ll ensure that this data is always the highest quality possible....",NOT_FOUND,https://www.indeed.com/rc/clk?jk=c42b4332e7a6f1a7&fccid=a01aa832f36be4d6&vjs=3,20 days ago
213,p_7b314cbda5939778,Boston,data+engineer,Research Intern,Google,"Cambridge, MA 02142 (East Cambridge area)","From creating experiments and prototyping implementations to designing new architectures, Research Interns and Software Engineers work on challenges in...",NOT_FOUND,https://www.indeed.com/rc/clk?jk=7b314cbda5939778&fccid=a5b4499d9e91a5c6&vjs=3,6 months ago
214,p_7f886caf66a4fa66,Boston,data+engineer,Big Data/PySpark Engineer,Avanade,"Boston, MA","1,000 data engineers. Deep experience in developing data processing tasks using PySpark such as reading data from external sources, merge data, perform data...",NOT_FOUND,https://www.indeed.com/rc/clk?jk=7f886caf66a4fa66&fccid=5386281035076fdf&vjs=3,9 days ago
215,p_cf5d104594de773e,Boston,data+engineer,Data Engineer,"Trinity Partners, LLC.","Waltham, MA 02451",Responsibilities for Data Engineer. The Data Engineer will support our existing team and analysts on data initiatives and will ensure optimal data delivery...,NOT_FOUND,https://www.indeed.com/rc/clk?jk=cf5d104594de773e&fccid=641eb23b7bcf081d&vjs=3,4 months ago
216,p_ffc507a0f3b23fed,Boston,data+engineer,Product Analytics Engineer,Pluralsight,"Boston, MA","Experience with data management platforms (e.g. Understand Pluralsight business, product strategy, data, and tools....",NOT_FOUND,https://www.indeed.com/rc/clk?jk=ffc507a0f3b23fed&fccid=51dc2e5aecda9e29&vjs=3,4 days ago
217,p_8b5c2952ac9416be,Boston,data+engineer,Data Backup Administrator,Commonwealth of Massachusetts,"Boston, MA 02111 (Central area)","Data Retention Compliancy. The backup engineer will perform daily system monitoring, verifying the integrity and availability of all backed up data....","
                $65,965 - $123,829 a year",https://www.indeed.com/rc/clk?jk=8b5c2952ac9416be&fccid=4dd38d4e4cf0b7c0&vjs=3,5 months ago
218,pj_0ed122a2e7b996ec,Boston,data+engineer,Siri - Senior Data Scientist (Machine Learning & Natural Language),Apple,NOT_FOUND,This role also involves technical leadership and mentorship of data scientists and machine learning engineers....,NOT_FOUND,https://www.indeed.com/pagead/clk?mo=r&ad=-6NYlbfkN0D4BtUbIrDMkalq6ptvGBorBWk-T6D_x1TipmER1OxNA9z07-yGEh2dSWRzX8wqAptVrDOq-s0mSesalBIvFypImfCctj9N_TvBdKeS3t9jw6AA-Hcvrchtelz0UTFWgSzLghv96iT6uPCFM7oxS_UAkmOh-w71ALqzi8gpLJhLa72iiIvd9s8n_7k6OKdYcBdcSCNy09p_iQZDZaO7ThLi4TwwAXn0NYIj-CB7ytJNqNev-2TmrE5-Z48NelLsc_tYGbJm8WdGiTLS31LnZ3hoZc-7rt5XXlLJ2yZZhqGE1fP2GvIP6o7-s2ZFDC8hDpiCnslcAKBQZyNRRV5mVp7s26Vl5txS3PYMNEZIYQSyE5Z9hHijCW_kSBAOUyJd6Vb2rovid2-_7_iPvrCp32x3v0A3znrevO77MxpamNhdZqLbjdQNuE5KXchNJt7jIrv18jiCwDEUuo8Gdk5bA5HOE-p9xpljujsQ2JM_wNinv61E76kefzSQQoId7ophqehpnNcETOP3RSLVsRklaXF5bu1XLZ1QgNBCGEeb7NKJApL6GA4-OEBlQ_nD9943KKw9itEOh9c0S3oXr7y899fGzjWOA3bxnGq_CvpUFGz9RR_z8mwstID9M32z_nSUHLdZD-b7IrwSIKLHvFN826v-wX9OMIW7PNQSQeS5kB7tWg==&p=10&fvj=0&vjs=3,NOT_FOUND
219,pj_79cf28cf1a59a2c2,Boston,data+engineer,Data Architect,Wayfair,NOT_FOUND,"A data architect builds the foundation of Wayfair's data ecosystem, partnering across engineering and business to ensure the timeliness, cleanliness and...",NOT_FOUND,https://www.indeed.com/pagead/clk?mo=r&ad=-6NYlbfkN0BWKOYaUJfzlpbj8B4EVHsr8Rk3do3CBb7WzQD7M0cgO4MmQYBeubwD0nUaCahAaLhz3rqYe-iK6Wc0QxBMD-_Wu2HLMLhLJI-Y3rzxcZRSwY9fvZs1Y3uJcPW6XOcaYD75fKkB1XAJkgT9KayCvVWRC2o9SXD1SPZMNxEr-hITvksPK-JO2FPtjRXIB4vmfaUCipFiS3slrvH_V3dundh5Lc9j5zwElOjFU7YKuG-KyZtJmbv_Vwsclj1yNWzCh6H8QRIfCAZWVIQ-LbfA6ToAm0ykhsMEOn5I2_h8vk-SdH96n1tqlBvqS_edG-M9w7mhah0PE57NVi6ds0one2I7iSl9PYJE-g6NTsZVpbIMf6CqNTIre5tSiU_VEpxeP8zZk2o4URUkHCV8_Xi6oayDWI3IRx5bF7QMy2gmTBvMeTK4U-FpSDRri35OxyA1H8eV_U7ARRuwKiqOam1ZOOvhh_xkSvU-sHDSNDMAljF2eqc9rW-BFmQLSZLgdVZ1GJloQrYF5ZtdM6TIyA8bAK6egVD-ccBMBFF6lEBIgA3C6C5leXC-vk9qmgCoxYvcITM=&p=11&fvj=0&vjs=3,NOT_FOUND
